text,label
Je me sentirais bizarre de vivre ici pendant que Mike est parti,5
J'espère que vous êtes resté avec moi tout au long de ce poste et que vous vous sentez aussi révolté et choqué que je me sens,5
Je ne suis pas sûr si nous devrions acheter plus mais mon mari et moi sommes assez impressionnés,5
Je me sentais très surpris comme un id de mal de tête depuis avril semblait finalement être vani,5
J'étais terrifiée que nous étions super foutus mais sous mon désespoir d'année il y avait aussi ce sentiment de ruse que le moment était aussi si drôle et si plein d'amour et je savais que d'une certaine manière et il se sent comme le genre de moment terrible incroyable je suis inspiré par théâtral,5
Je me sens impressionnée par,5
J'ai plus le sentiment de ce que ça a dû signifier pour les gens qui y vivent et j'ai été impressionnée.,5
Je suis surpris de voir à quel point il y a une partie de moi qui n'est pas surprise que c'est comme ça que ça s'est terminé pour lui.,5
Je me sens bizarre ces derniers temps.,5
Je me sens toujours drôle,5
J'ai commencé à me sentir drôle,5
J'ai commencé à sentir qu'il était curieux et il s'est demandé,5
"Je les ai listés, je me sens tellement débordé.",5
Je me sens bizarre deux jours avant ça.,5
Je me sens drôle si mes lèvres sont nues,5
"Je ne dirais pas que j'ai le désir d'aller courir, mais je me sens curieux.",5
Je me sens submergée par tout ce qui m'est demandé à l'église.,5
Je me sens encore un peu bizarre d'appeler le ceo de ma compagnie Bob mais se têtu après qu'il m'ait corrigé à plusieurs reprises,5
Je sens qu'il est juste débordé parce qu'il pense que cet argent doit être sauvé aujourd'hui,5
Je pense que je dois commencer par combien je suis impressionné que Alexandra était seulement quand elle a écrit ce livre,5
Je pense que c'est bizarre sur ses cicatrices si ive l'éteignait,5
"Je ne l'aimais pas, je ne tombe pas amoureuse de lui ou je me sens étonnée par lui.",5
Je me sens un peu drôle d'affichage sur mon anniversaire,5
Je ne sais pas pourquoi je me sens si choquée mais je suis humaine et c'est ce que je ressens en ce moment.,5
Je me sentais tellement bizarre que les nouvelles ne s'inscrivaient pas vraiment.,5
J'avais été débordé par les blogs ces derniers temps.,5
Je me sens submergée par tant de choses à faire et stupéfaite que tant de gens m'ont soutenu.,5
"Je me sens stupéfait comme si je ne pouvais pas croire que c'est réel et éblouissant et rare, nerveux et excité et affamé",5
Je me suis sentie aussi stupéfaite qu'ici.,5
Je regarde en arrière et me souviens me sentir étonné pendant que je me tenais à cette chaire que je pouvais trouver une certaine tendresse dans mon cœur,5
"Je n'avais jamais été dans aucun théâtre auparavant et c'est la première fois que je le fais, alors ça me rend curieux et frais.",5
Je me sens incroyable ive n'a jamais été plus plein en ne grignotant pas beaucoup du tout et quand je suis une poignée de noix ou une cuillère de beurre d'amande,5
"J'ai été virée hier et même si j'avais l'impression que ça pourrait arriver à cause de l'opération, j'étais encore un peu choquée.",5
Je me sens aussi stupéfait parce que nous sommes allés nager chaque semaine depuis des semaines.,5
Je me sens dépassée et effrayée.,5
Je l'ai vue aujourd'hui à notre dernière classe avant la pause d'été et ça a rendu mon ventre tout drôle,5
Je ne me réfère pas à l'absence de ses vies antérieures plutôt que c'est comment elle s'est perçue comme non réelle et n'a pas droit à des sentiments qui m'avaient curieuse et juste un peu contrariée en son nom,5
"Je ne me sens pas beaucoup de coussin d'un essai donc je ne suis pas trop impressionné initialement, mais il devrait se casser et commencer à adoucir avec l'utilisation comme la plupart des mousses font",5
"J'ai trouvé qu'il pourrait être assez difficile à enlever, mais votre peau se sent incroyable après si certainement vaut le tracas",5
ive vient de terminer la lecture d'une histoire de torchwood si bien que je me sens un peu surpris,5
Je me sens incroyable et je vais m'habiller et d'autres je me sens comme je pourrais faire mieux et que s quand je viens juste de boucler sur le canapé et regarder netflix toute la journée,5
J'ai l'impression que nous étions tous surpris que ça ait duré si longtemps.,5
Je me sens toujours surpris quand je pense à la masse terrestre couverte par l'indus,5
Je me sens drôle à ce sujet car je ne savais pas que je gagnerais une telle attention,5
Je me sens de plus en plus débordé quand j'ai rencontré un titre de petites choses sur dieu href http littlesthingsaboutgod,5
Je continue à me sentir incroyablement débordée.,5
Je sautais dans la danse en appelant mes parents pour leur dire ce que je ressens et comment Dieu m'avait étonné.,5
J'ai commencé à penser à tout ce que j'avais à faire pour planifier un mariage. J'ai commencé à me sentir dépassée.,5
Je me sens débordé par ce que l'id aime dire sur ce sujet,5
J'ai l'impression que je vais faire tomber beaucoup de spoilers juste pour être des abrutis drôles.,5
"J'ai les outils nécessaires, mais je ne suis pas capable de ressentir ce que je suis un peu curieux de ce que je ressens et de ce que je fais quand je me marie et que ma femme et moi faisons l'amour.",5
im gauche se sent éblouie et tremblante légèrement giggly,5
Je me sens impressionnée par moi-même ce soir.,5
Je me sens toujours choqué et en colère et finalement brisé le cœur,5
Je les sens avec cette curieuse href http seaderma,5
Je connais certainement le sentiment de cela quand les mots coulent presque plus vite que je ne peux taper quand je suis étonné que je relis le dernier chapitre parce que je n'étais pas celui qui l'écrivait simplement celui qui prend la dictée,5
Je lis des fanfics sur Internet Je me sens tellement étonné et j'envie toutes ces personnes qui les écrivent,5
J'ai fini par me sentir comme si j'étais celui qui a été surpris par un cadeau pas l'inverse,5
J'ai l'impression qu'il y en a des que j'ai encore à visiter.,5
Je me sens abotu n'importe quel couple im impressionné,5
"Je me sens encore stupéfait de certains événements qui se sont produits à Noël avec des membres de ma famille et je ne suis pas sûr si je devrais écrire sur eux, mais ils pourraient faire un script intéressant",5
Je me sens débordé par les couvertures du magazine montrant l'arbre de Noël parfaitement décoré et les paramètres de la table de vacances,5
J'aime le sentiment tingly de leurs produits à lèvres et im impressionné par la qualité du mascara jusqu'à présent aussi,5
Je me sens incroyable c'est une href http shantellygirl,5
"Je sens son plaisir d'une manière étrange et pas tout à fait heureuse, mais d'une manière que je ne ressens nulle part ailleurs",5
"Je me sens débordé de tout le reste entre youtube travailler mes emplois secondaires, etc.",5
J'ai le sentiment d'être choquée.,5
Je me sens drôle si je n'en ai pas dans ma poche de pantalon gauche,5
Je pouvais voir et sentir son inconfort à cet hommage et j'ai été une fois de plus impressionné par son humilité,5
"J'ai l'impression qu'il y a tellement de gens incroyables, mais je vais choisir une icône trans appelée href http www",5
Je ne me sens pas surpris.,5
Je me sens incroyable et par incroyable c'est comme la relaxation que vous ressentez quand vous ne vous souciez pas du tout,5
J'ai entendu cette phrase avant que vous ne vous sentiez peut-être même pas complètement choqué et agacé quand j'observe que j'ai toujours vu et entendu trop intelligent de personnages d'entreprise,5
Je me sens si bizarre.,5
Je me sens incroyable d'avoir tellement fait au travail aujourd'hui et je suis aussi rentré à la maison et nettoyé chaque pouce de la maison pour ma famille qui vient en ville demain,5
"J'ai l'impression que le spectacle s'est nivelé dans un étrange niveau de médiocrité où il est juste assez intéressant pour continuer à regarder, mais pas assez terne pour tomber",5
Je pense que le sentiment de bonheur m'a vraiment surpris.,5
Je ne devrais plus me sentir choqué pour les injustices commises aux danseurs orientaux en egypt,5
J'ai tapé ceci après avoir lu un long chemin vers le bas et me sentir un peu stupéfait par l'impact,5
Je sens le remorquage du tissu contre mes cuisses et les fesses je suis submergé par le sentiment que je suis juste trop grosse,5
"J'ai l'impression de me sentir débordé quand tu t'approches de moi, je ne sais pas ce que tu sais, je n'ai pas l'habitude d'être balayée et manipulée comme si je pesais à peine un truc.",5
"J'ai l'impression que pendant que la communauté de glissades elle-même était incroyable, l'entreprise n'était pas assez agressive pour attraper des gens en dehors de cette communauté pour venir jouer.",5
Je trouve que mon esprit ressent ces sentiments étranges,5
J'ai commencé à descendre l'aventure se sentant totalement ridicule et se demandant si ce n'était pas juste une perte de mon temps que quand j'ai vu cette capture d'écran,5
J'ai eu le sentiment que mon gp était très impressionné bien que j'ai encore un moyen d'y aller,5
"J'aurais pu arrêter ça si je sentais que ça n'en valait pas la peine, mais j'étais quand même curieux d'ajouter des amis.",5
i pour son impraticable suggestion se sentent choqués,5
"ive a réussi à ne pas se sentir trop débordé, bien que je m'inquiète un peu que je n'accomplisse pas tout ce dont j'ai besoin pour",5
J'avais un niveau de programmation équitable et maintenant je peux dire que j'ai un bon niveau de programmation parce que je me sens à nouveau curieux de tant de choses,5
Je mange encore alors j'ai le temps de courir après le travail me semble ridicule ces jours-ci,5
J'ai le sentiment d'être désagréablement surpris par les résultats,5
"Je ne ressens aucune sympathie pour lui pour les situations ridicules et perverties qu'il finit dans, mais je suppose que les scènes calmes m'ont gagné au moins un peu, mais maintenant que je m'arrête et pense à cela, je me demande ce que naru est censé gagner en s'associant à un tel loser",5
J'ai été laissé en partie impressionné et en partie comme ce qui vient de se passer.,5
Je regarde en arrière mes photos plus anciennes et me sens choquée et stupéfaite que j'étais si maigre avant,5
J'ai commencé à me sentir étonnée.,5
Im y arriver mais je me sens vraiment ébloui et confus en ce moment,5
Je touchais ses cheveux en sentant comment il a glissé au-delà de mes doigts laissant d'étranges picotements que je ne pouvais pas arrêter,5
J'ai lu les évangiles dans le lit se sentant curieux mais détaché,5
J'ai l'impression d'être im entre deux scènes.,5
Je sens que ça me va et qu'il n'y a rien de drôle autour de moi.,5
"Je me sens endormie et déshydratée sur le chemin de la maison, mais nous le faisons sans incident et je commence sur le blog le lundi soir",5
"J'avais l'habitude de ressentir un étrange sentiment de peur quand la corne a été tropée au début, mais maintenant c'est juste un acte simple et nous y allons",5
"Je deviens employé, je vais lentement les remplacer par des fils légèrement plus slinkier qui mettent une étincelle dans mon œil et m'aider à me sentir pour prendre cette chose étrange et merveilleuse appelé la vie",5
Je m'assieds à l'auteur cette lettre je me sens un peu surpris qu'une année entière nous ait déjà passé par,5
"Je le sais, mais je me sens encore très bizarre avec la pensée.",5
Je me sentais ébloui en rentrant à l'arrêt de bus après que des dames âgées soient venues me voir et m'ont serré les bras.,5
Je me sens vraiment bizarre et étrange et ce n'est pas quelque chose que je peux vraiment mettre en mots mais déconnecté vient le plus près,5
Je ne peux vraiment pas compter le nombre de fois où j'ai pleuré me sentant submergé par quelqu'un expression de préoccupation ou juste par le fait même qu'ils pensaient à moi,5
Je ne pouvais pas arrêter de lire alternativement en me sentant choqué par la violence des enfants et par le manque total de bon sens dans leur approche e,5
Je suis parti aujourd'hui me sentir impressionné par ce que j'ai vu et entendu,5
Je m'assois sur notre porche arrière après le film et j'essaie de savoir pourquoi je ressens une curieuse déception dans ce qui vient de voir,5
Je me suis réveillée et mes cheveux me semblent étranges.,5
J'ai eu beaucoup d'hommes sans soins dans ma vie et il me semble quand même étrange d'avoir plusieurs qui m'appellent et de me tendre la main quand je suis à mes moments les plus faibles,5
J'ai certainement traversé le blues du bébé pendant les premières semaines me sentant submergé par le bonheur et la tristesse j'ai pleuré chaque fois que j'ai pensé à Jeff retournant au travail parce que je ne pouvais pas croire qu'il allait jamais devoir être loin de Finn,5
Je ressens le besoin de mentionner cette vidéo incroyable qui a changé ma vie,5
"Je ne pouvais pas m'empêcher de demander ce qu'il ressentait à ce sujet et j'ai été assez surpris quand il a répondu que je n'avais jamais publié de chiffres, mais j'ai presque fait très tôt.",5
Je pouvais sentir qu'il était choqué mais il a apprécié.,5
Je me sens incroyable et je ne suis pas affriad éminem,5
J'ai l'impression d'être stupéfait.,5
J'ai besoin de retourner à l'écriture sur une base régulière et de travailler sur l'articulation lorsque je me sens dépassé ou besoin d'aide,5
Je me sens incroyablement débordé en ce moment il y a une pile de linge propre pour traiter la vaisselle attendant dans l'évier les enfants se disputant qu'ils s'ennuient cant on joue à un jeu,5
Je me sens plutôt impressionnée par moi-même à propos de maintenant.,5
J'ai toujours l'impression que nous sommes sur un épisode de la course incroyable chaque fois que nous essayons de trouver quelque part dans mumbai car les adresses sont vraiment juste un guide rugueux et joachim doit invariablement arrêter la voiture de nombreuses fois pour sauter et demander de l'aide qui n'est pas toujours très proche,5
Je me sens étonnée et très reconnaissante d'avoir une technologie si étonnante à portée de main,5
Je me sens choqué quand tu utilises le mot baise,5
"Je pense que c'est mon voyage pour faire ça pour les autres, mais je suis toujours surpris quand les autres le font pour moi",5
"Je me concentrais sur le bruit et me demandais d'où ça venait, je ne le sentais pas, mais de toute façon, c'était une nuit bizarre et nous nous demandons s'il pourrait y en avoir d'autres à venir.",5
Je me sens bizarre quand ça arrive un href http www,5
"Je me sens choqué par les ténèbres, j'ai en fait été chargé de situations impossibles et sombres, confiées à des situations qui exigent des dieux une bonté merveilleuse et une intervention divine.",5
Je dois admettre que je me sens assez débordé.,5
Je peux sentir que c'est débordé et un peu sombre,5
Je ne peux pas m'empêcher de me sentir profondément choqué,5
Je me sens un peu débordé entre tout ce que j'ai dans ma vie entre le travail scolaire mariage planification vacances pauses et les responsabilités quotidiennes générales,5
J'ai l'impression que cela résume la vanité des humains images drôles citations drôles mèmes drôles photos échoues autocorrecte meta name twitterimage content http data,5
l'impression d'être fatiguée et fatiguée,5
"Je suis assez habitué à ça et le mettre à mon médicament comme d'habitude, mais pour le carol de l'avoir trop quelque chose ne se sent un peu étrange et je détesterais que notre dernière semaine soit passée à être malade",5
"Je suis un enfant, mais je n'y suis arrivé qu'à mi-chemin avant que mes dents commencent à me paraître bizarres.",5
im appréciant regarder camden grandir et sentir ses petits coups étonnants,5
Je me sens incroyable.,5
"J'ai l'impression que si tu étais vraiment curieux de moi, tu poserais au moins quelques questions ou quoi que ce soit pour qu'on parle.",5
Je me souviens m'être sentie si stupéfaite.,5
Je me sens incroyable dames son incroyable ce que manger de la bonne nourriture et l'exercice peut faire pour vous faire sentir grand et faire votre cerveau feu mieux,5
J'ai l'impression que l'utilisation de la période là-bas montrera à quel point c'était incroyable et addictif.,5
J'ai entendu des jus de fruits que vous avez besoin de monter cela pendant quelques jours et puis vous vous sentez incroyable,5
Je ne peux pas vous dire combien de fois au cours des dernières années quand je suis à une sorte de rassemblement qui est nouveau dans mon environnement je me sens drôle mais aussi différent,5
Je me sens curieux et intimidé à la même instance,5
"Je pense à l'habitat dans son ensemble et le vois comme la somme de toutes ses parties travaillant ensemble, il me semble plutôt incroyable et spectaculaire et je me rends compte que je peux trouver toutes les pièces dans le temps",5
Je ne me sens pas choqué.,5
Je suis déjà stupéfait de voir comment l'histoire en elle-même prend déjà sa propre vie.,5
Je veux leur parler à qui que ce soit. Je ne sais pas comment exprimer ce que je ressens.,5
"J'ai l'impression de tomber amoureux de ça, c'est d'être étonné de voir comment ça rend notre famille tellement meilleure",5
J'ai commencé à chercher comment les membres actuels pensent à ce sujet amp i a été choqué,5
Je reconnecte avec une amie de décennies parce que ma génération peut se référer à des choses dans des décennies maintenant qui se sentent étranges en soi et me voient à travers ses yeux,5
J'adore courir et comment je me sens incroyable après avoir saigné les pieds et tout,5
"J'espère que Dieu se sent comme donner à la charité aujourd'hui xd n'importe qui j'ai deux critiques de concert pour écrire mais comme je me sens comme Athena essaye de sortir de mon crâne, il devra attendre un autre jour et si vous étiez curieux j'ai vu la bande son de la ville de mouvement vendredi dernier et c'était omg si drôle",5
Je l'aime et je trouve difficile de mettre en mots la façon dont elle me fait sentir parfois quand je vois le regard dans ses yeux quand elle me regarde ou mon fils je suis étonné et me demande comment j'ai eu la chance de la rencontrer encore moins avoir un fils merveilleux avec elle,5
Je me souviens t'avoir vu parler et te sentir vraiment impressionné par ta confiance et ta connaissance.,5
Je me sens surpris par la façon dont la reconnaissance semble créer plus d'espace pour lui,5
J'ai le sentiment fou que personne ne s'en soucie ou qu'ils penseront bizarrement à certaines choses ou à certaines choses.,5
Je me suis réveillé en me sentant drôle et j'ai pris un pré,5
Je me souviens me sentir drôle que j'étais excité d'aller au campus où de retour au lycée id taquinés camarades de classe qu'ils sont seulement allés là parce que Byu ne voulait pas les emmener,5
Je continue à me sentir étonné par la façon dont Dieu se montre dans les détails,5
"Je ne sais jamais qui lit mes messages, mais je me sens bizarre quand je ne les met à jour pas souvent.",5
Je pense que je devrais signaler maintenant que ce blog n'impliquera pas une vidéo il ne sera probablement pas très drôle mais il vous donnera un aperçu de mes pensées aléatoires au cours de la dernière journée ou ainsi,5
Je commence à m'inquiéter que les gens me trouvent bizarre ou ne m'aiment pas alors je me sens bizarre autour d'eux et mal interpréter tout comme ils ne veulent pas de moi,5
Je me sens stupéfaite Je réagis émotionnellement,5
Je peux à peu près vous garantir que vous vous sentirez incroyable,5
J'ai eu le sentiment général qu'elle n'était pas impressionnée.,5
"ive a été invitée à beaucoup de pièces de théâtre, de comédies musicales et de concerts qui se sentent tellement débordés",5
Je revois des situations qui me font ressentir des sentiments forts J'ai ces affirmations pour m'aider à me sentir curieux,5
i pm hehehe anyasimbi pm prend une sieste chérie pm hermione se sent toujours assez ébloui assis à côté d'Harry regardant autour,5
Je ne peux m'empêcher de me sentir surpris par le phénomène des papas fille et mommys garçon,5
J'essaie de passer autant de temps avec mes chiens que possible et souvent quand je me sens submergé par le travail des clients ou tout simplement ininspiré je vais juste sauter dans la voiture avec l'un des chiens et aller repérer de nouveaux endroits,5
Je regrette maintenant de ne pas écouter tame impala s se sent comme si nous allions seulement à l'envers est incroyable c'est la musique détendue les gens devraient être à l'écoute,5
Je me sens tout impressionné par moi-même.,5
Je me sens drôle si je suis misha dans l'autre sens,5
Je me sens maintenant très étonné de ne pas avoir compris à quel point j'ai été vaincu.,5
Je me sens un peu drôle.,5
Je ne peux pas me sentir zoné et étourdi ces petites pilules sont posées pour me faire bien,5
J'aime ma famille et la moitié j'ai envie d'être un connard aujourd'hui et peut-être que la moitié de l'auto-déprécation est drôle.,5
Je suis le seul qui se sent bizarre d'avoir une douche jetée pour eux,5
Je me suis réveillée en me sentant si curieuse du rêve que j'ai fait cette nuit-là.,5
"J'étais lent et en train de traîner sur mes pistes, mais je pouvais immédiatement dire que le coussin se sentirait incroyable à la fin d'une longue course",5
Je me sens étonnée et heureuse,5
Je me sens un peu surpris comme si je ne savais pas de quoi elle parle.,5
Je me sens assez étonné que nous ayons l'air d'avoir une base de fans mondiale,5
Je n'ai pas de source régulière de revenus pour notre adoption. Je me sens un peu dépassé.,5
im commencer à se sentir à nouveau submergé quand il s'agit de la recherche pour ce livre,5
"Je marque le site d'entrée perplexe à quel point je me sens calme alors que je me lave les mains, je suis choqué de constater qu'ils ne tremblent pas dans le moindre",5
J'ai le sentiment que ce sera un thème récurrent dans certains de mes billets de blog ce mois-ci donc ne soyez pas surpris si vous voyez quelque chose intitulé devenir moi partie dans un avenir proche,5
Je me sens bizarre de ne pas l'écouter maintenant.,5
J'ai essayé de travailler là-dessus sans travailler sur autre chose et ça aussi me fait me sentir bizarre et gritty,5
Je dis inquiet je veux dire assez d'inquiétude pour sentir quelque chose dans mon estomac si elle dit qu'elle a été ébranlée ou malade ou quoi que ce soit,5
J'ai eu le sentiment et n'ai pas été choqué du tout.,5
"J'étais en train de me vanter de me sentir étonnée de voir non seulement comment je pouvais me sentir moi-même, mais aussi sirius en moi.",5
Je me sens étonné que j'aie pu rater ce que ça veut dire d'être chrétien par tant de choses.,5
Je sais si je regarde la grande image je deviens déprimé et c'est un peu comme perdre du poids si je pense que je dois perdre des kilos je me sens dépassé mais si je pense que je dois perdre un gramme cette semaine,5
Je ne me sentais pas vraiment enthousiasmé que j'étais juste excité qu'ils aient cette émotion d'utiliser haha,5
J'ai rendu quelqu'un un peu moins bizarre parce qu'ils se trouvent faire la même chose,5
J'ai encore un très bon sentiment sur cette chanson et ne serais pas surpris si elle va au moins haut s'il peut livrer une bonne performance vocale,5
Je développe la boraphobie et je deviens terrifié de ce que c'est qui me fait me sentir incroyable en fin de vie et d'avoir à retourner à ne plus me sentir génial,5
Je me sens dépressif et horrifié mais généralement l'équanimité de l'humeur web règne,5
Je me sentais très ébloui ce matin.,5
Je dirais même que c'est important dans la mesure où mon important autre pense de quoi que ce soit et que le reste a été ridicule,5
"Je sais qu'im en fait une grosse affaire, mais je me sens choqué que je puisse conduire.",5
Je suis surpris que les scientifiques s'interrogent sur la façon dont il est bizarre que les conditions initiales de l'univers soient adaptées à des valeurs très spéciales de sorte que notre univers soit presque plat,5
J'ai arrêté de me sentir un peu choqué,5
"J'ai fini de le lire, je me sens tellement surpris par l'héroïne dulalala",5
Je me sens aujourd'hui je viens de lire mon pote salinas post et a été complètement étonné de toutes ses références philosophes donc je vais dire que je me souviens d'un certain professeur de philosophie que j'ai eu dans une classe de mythologie grecque qui a toujours aimé dire dire ce que vous ne ressentez pas ce que vous pensez,5
"Je pensais que Karen était assez connue pour les fans qu'elle n'aurait pas l'impression d'être trop bizarre, surtout avec son lien avec le jsa.",5
Je me sens tellement stupéfait maintenant parce que judy mikovits tir a toute l'apparence d'être le dernier chapitre probable de l'histoire wpi,5
"Je me sentais bizarre comme un soldat de dinosaure après les avoir lus parce que dans une sorte bizarre d'adulte ou peut-être à l'université, mon cerveau était en train d'analyser les livres.",5
Je n'ai pas écrit le nom et la description de la dernière fois que je suis là à transpirer et à me sentir débordé d'eux avant moi.,5
Je ne peux m'empêcher de me sentir étonné par le kaléidoscope en constante évolution qui est la vie,5
Je sens un étrange type de paix avec ce tour que je n'ai jamais ressenti avec allié,5
"Je me sens comme si j'appartenais, mais la réalité se réaffirme et je suis brutalement choquée par la naïveté de mes croyances.",5
