text,label
Je me sens comme une femme à un parker déjà agité,4
J'ai acheté il y a des mois tout en me sentant assez mal à l'aise sur mes cuisses et mes cuisses et ce fait une telle différence à la fermeté de ma peau,4
Je suis devenu si craintif de ce qu'on m'a dit et des pensées,4
Je me sens agité niveaux de stress irritables sont énormes j'ai une grosse bosse dans ma gorge mes yeux ont cette eau constante autour d'eux,4
Je me sens réticent.,4
J'ai l'impression de vouloir t'appeler mais j'ai peur d'être dupé à nouveau.,4
"Je suis inquiet avant de rencontrer quelqu'un de nouveau, particulièrement dans une situation de groupe, mais je m'engage pour tout ce que je peux et j'espère que j'aurai trouvé le courage de le faire d'ici là et j'ai toujours jusqu'à présent",4
Je ne peux pas effacer le sentiment qu'il se passe quelque chose d'étrange.,4
Je me suis réveillée en me sentant tremblante et nausée avec beaucoup de crampes et de pression dans mon abdomen et mon bassin,4
Je me sens bizarre d'une façon ou d'une autre,4
"Il y a quelques années, je me souvenais du début du mois de décembre où je me sentais le plus agité du travail supplémentaire que les vacances exigent de la mère avec un emploi du temps déjà surchargé.",4
Je me sens de moins en moins terrifié et de plus en plus positif que notre rêve d'élever une fille se réalise,4
Je sens que zhao wu déteste le plus suspect un href http vdznxlpufgen,4
J'ai l'impression que ça se prête à être très bien affligé.,4
Je me sens terrifié pour nous et notre gentil petit homme,4
Je n'étais pas sûr d'avoir le taxol depuis que j'ai commencé la chimio.,4
Je me sens effrayé par la maladie et la mort,4
Je me sens beaucoup moins anxieux d'avoir un bébé et de commencer à l'accepter et j'attends avec impatience,4
"Je suis excitée de dessiner du collage de peinture et de me salir les mains, mais pour quelque raison que ce soit, je me sens un peu dépassée.",4
Je me sens vraiment indécis aujourd'hui et j'ai besoin d'aide pour décider ce qu'il faut faire pour dîner.,4
Je me sens très stressé surtout parce qu'on m'a appris à faire confiance aux gens et à ne pas accuser les gens et j'essaie,4
Je me sens un peu inquiet de tourner,4
Je me sens sérieusement douteux si l'une des choses que j'aime appeler mon apprentissage ou mon éducation ou quoi que ce soit a ajouté même un sou de valeur dans ma vie réelle,4
Je me sens agité de sauter d'un projet à l'autre,4
J'ai lu le livret sur la pilule d'avortement je me sentais sceptique à ce sujet au début parce que les effets secondaires étaient un peu effrayants que la pilule me fera avoir une fausse couche et des crampes d'estomac comme wow,4
Je me sens ébranlé Je me sens en colère Je me sens comme je m'en soucie quand personne ne se soucie de ne pas essayer de travailler les choses à chacun son propre est notre nouveau concept et modèle,4
J'étais à la plage l'idée d'une plage occupée et ramasser la litière parmi des groupes de gens a commencé à me faire sentir un peu appréhensif et j'ai presque changé d'avis,4
Je me sens tellement agitée,4
Je n'ai pas permis la possibilité de se poser que le déménagement me ferait me sentir incertain et hors de toutes sortes,4
"Je me réjouis de l'opportunité d'un véritable partenariat, je ne dirais pas la vérité si je n'admettais pas de me sentir aussi inquiet.",4
"Je me sentais anxieux, nerveux et ennuyé.",4
Je me sens si indécise dans la vie,4
J'ai l'impression que je devais être coincée ensemble.,4
Je suis allé discuter avec quelqu'un qui est maintenant mon mentor se sentant très sceptique en pensant que cette personne était complètement crackers et ce ne serait pas pour moi,4
Je ne me sens pas sûr de me sentir aussi un peu excité.,4
"J'ai trouvé que je ne supportais pas l'idée qu'une fille soit cruelle à punky sans raison, pas quand elle se sentait déjà si incertaine sur sa position sociale dans la classe.",4
Je me sens incertain sur la façon d'être ok avec une certaine attention sexuelle au nom de la rencontre et de botter le cul en général,4
ive a passé beaucoup trop de temps à ressentir de la douleur au point que j'ai peur de m'y laisser ouvert.,4
J'étais quand sur les conventions il a cette chose merveilleuse de ne pas se sentir embarrassé d'être là,4
"Je me suis réveillée aussi agitée et nerveuse que la veille, mais pour des raisons très différentes.",4
Je me sens un peu coincée et maladroite.,4
"Je me sens terrifié par le fait que je deviens fou, je suis terrifié par la mort.",4
Je me sens un peu angoissée.,4
Je me sens un peu moins effrayée à ce sujet.,4
"Je pense que je ne serais pas un peu dérangé d'entendre que tous les forages devaient cesser immédiatement dans le dakota du nord jusqu'à ce que des logements abordables soient disponibles dans toutes les régions tous les niveaux de revenu, etc.",4
Je me sens beaucoup moins débordée maintenant,4
J'ai le droit de me sentir effrayée et de dire que j'ai peur.,4
"Je ne veux pas me sentir douteux de moi-même, mais je suis le genre de personne qui fait face à la réalité sans rester dans le déni",4
Je ne me sentais pas pressé d'être honnête dans ma réponse à son travail.,4
Je me sentais mal après la course en mémoire de la femme qui a été enlevée et assassinée.,4
Je deviens juste une version plus distillée de moi-même frappant la peur dans le cœur de beaucoup alors je ne ressens pas besoin de mettre quelqu'un d'autre dans cette image même si je ne pense pas que je serais si hésitant à ce sujet maintenant,4
J'ai le sentiment que vous êtes assez sceptique si on vous a dit de demander si vous avez un lien avec un anniversaire avec le numéro que j'ai si j'ai hoche mais vraiment il aurait pu dire n'importe quel nombre et j'aurais alors dit ahhh toujours pas convaincu,4
J'ai aussi dit qu'il comprendrait si cela lui serait mal à l'aise ou ne lui conviendrait pas en raison de son emploi du temps.,4
Je suppose que me brûler m'a laissé paranoïaque et délirant.,4
Je me sentais alarmé.,4
i nevins je me sens réticent à prendre de l'espace avec ce point,4
Je touchais ses cheveux en sentant comment il a glissé au-delà de mes doigts laissant d'étranges picotements que je ne pouvais pas arrêter,4
Je me sens très indécis à propos de ce poème et il m'a pris un moment pour poster,4
"Je peux sentir l'attraction en retour à cela, mais im hésitant à le laisser partir",4
Je me sens vraiment dérangée maintenant confuse et frappée et tellement hors de la place,4
J'ai rompu avec toi parce que je pouvais me sentir en train de tomber amoureuse de toi et j'avais peur.,4
Je ne suis vraiment pas intéressé et je me sens poussé à dire une raison de ne pas l'être.,4
"Je saute mon verre d'eau du matin, je me sens fragile et désorienté avec les débuts d'un mal de tête",4
Je lis ou je dors et j'essaie de ne pas me sentir agité en essayant d'honorer l'importance de la détente et du repos,4
"Je me sens pour Celia, mais elle est encore si peu sûre quand il s'agit de relations.",4
Je me sentirai timide de la publicité,4
Je me sens réticent à faire tout ce qui est listé ci-dessus,4
"Je ne sais pas ce qu'il pourrait être le temps qu'il pourrait être le fait que j'ai un anniversaire cette semaine, mais je me sens vraiment agité",4
id aller à la maison id juste obtenir cette sensation de naufrage dans mon estomac et id devenir vraiment tremblant,4
Je me sentais de nouveau douteuse.,4
J'aimerais ne pas me sentir si frénétique.,4
J'ai presque peur de détester ce livre.,4
Je me suis agenouillé pour me concentrer sur ma respiration et mon coeur jusqu'à ce que je puisse tenir mon pendule immobile et revenir au cercle un peu fragile mais tellement plus clair sur tout,4
Je me sens torturé pour chaque jour qui passe sans elle,4
Je les ai couverts à l'avant je me sentais un peu douteux à ce sujet et je n'aime pas sentir comme ça quand il s'agit de mes cheveux je l'ai aimé juste je pense que c'était trop de points forts à l'avant donc je l'ai couvert de bon noir naturel,4
Je me sens vraiment réticente à signaler,4
i changement je me sens plus vulnérable plus précaire,4
Je me sens un peu indécis quant à ce qu'il faut faire en termes d'alliance,4
J'avais été assez confus ces dernières semaines.,4
Je marchais avec une autre personne quand un gang nous a séparés et m'a poussé dans une maison.,4
Je pourrais ouvrir cette boîte et te trouver et ne sentir qu'une meloncholy reminisance au lieu de ce déchirement de cœur,4
im se sent toujours submergé et désorienté et pas moi-même mais déjà ive a pu voir et entendre de choses assez cool dans les trois derniers jours,4
Im se sentant émotionnellement vulnérable et encore coquillage choqué par la peur pour ma mère petit-fils devient sarcastique et grossier,4
im un chat effrayé qui aime se sentir effrayé par les films d'horreur,4
Je ne fais confiance à personne et je me sens paranoïaque,4
Je vous sens encore si proche de rejouer les mots éditant mes lignes im si secouées avec peur que personne ne puisse diviner je ne pouvais parler ces phrases clés qui pourraient nous amener à genoux tout ce dont vous avez besoin est de dire s'il vous plaît et mon corps est le chaos des douleurs d'adrénaline pour combattre ou fuir,4
Je me sens intimidé comme si je voulais juste me retourner et retourner dans la sécurité de mon cours de yoga ou sauter sur le tapis roulant éprouvé et fidèle,4
Je me sens pour tous les chats et chiens pétrifiés et les bébés qui sont soumis à quatre jours d'avions de chasse rugissant près du sol provoquant des structures à trembler et des fenêtres à hochet sans la conception de ce qui se passe,4
"Je suis toujours en train de subir plusieurs tests et d'éprouver des douleurs et des problèmes majeurs dans tout mon corps, mais ce n'est pas vraiment ce qui me fait me sentir si étrange",4
Je me sens tellement confus maintenant,4
Je me sens pressé de choisir l'emplacement parfait,4
Je me sens réticent à écrire ce blog non pas parce que je n'ai pas aimé l'œdipe mais parce qu'il est difficile d'analyser une histoire qui n'a pas de fin heureuse apparente,4
J'ai commencé à me sentir vraiment bizarre physiquement,4
Je me sentais confus et en colère aussi bien que très triste,4
C'est la raison pour laquelle c'est si parce que j'ai l'impression que mon expérience a été suffisante pour me faire agiter.,4
J'avais déjà peur et j'avais peur.,4
J'ai eu un petit peu de taches hier soir sans doute rien à craindre mais encore assez pour me faire sentir très nerveux,4
Je sais aussi ce que ça fait d'avoir peur d'essayer quelque chose de nouveau,4
Je me sens vraiment mal à l'aise tout le temps et finir par dire de la merde aux gens et tout gâcher,4
Je me sens un peu bizarre de quitter la nursery sur mon propre im pas aussi contrarié que je pensais que je serais,4
Je me sens anxieux et sans valeur,4
Je ne peux m'empêcher de me sentir sceptique à propos de tout ça.,4
pendant que j'attendais qu'ils me donnent les marques du sujet le plus difficile cette année,4
J'ai compris pourquoi ils n'étaient pas sûrs.,4
Je me sens coincée incertain réservé s'est évanoui,4
"Je me sens ébranlé ce matin par la façon dont certaines personnes sont prêtes à tuer l'innocent, que ce soit un génocide parrainé par l'État en Syrie, un norwegien qui protégeait son pays de la menace perçue d'une incursion extraterrestre ou deux hommes à Denver qui l'ont fait pour le ciel sait quelle raison.",4
Je me sentais assez effrayée après cette petite conversation pour vraiment ouvrir mes yeux pour regarder mon nez mais quand il avait tout enlevé et il m'a dit de regarder dans le miroir j'étais tellement surpris qu'il n'était même pas la moitié aussi mauvais qu'il m'avait dit que ce serait et je regardais un joli petit nez,4
Je sens que l'activité de l'écriture confère à un pouvoir étrange d'être pleinement en contrôle,4
Im se sentant vraiment agité et prêt à craquer sur quelque chose de stupide,4
Je me sens confus par mes propres attentes,4
"Je ne veux pas paraître prétentieux ou quoi que ce soit, mais quand je me sens incertain des choses dans ma vie que dire whitman walt me donne toujours un bon départ sur le point",4
Je ne me sentais pas pressé d'acheter quoi que ce soit en échange de ma méditation de bain de pieds et de cadeau musical,4
"Je ne reviens jamais plus d'un mois, je voudrais venir avec quelqu'un pour m'accrocher, pour me sentir moins vulnérable et plus libre d'être moi-même et surtout puni.",4
ive s'est déjà sentie dépassée,4
Je me sens toujours secouée.,4
ive a apprécié l'expérience et j'éprouve maintenant une certaine appréhension quant à l'endroit où aller d'ici.,4
Je comprends que je ne sois peut-être pas en sevrage mais je n'ai pas manqué un week-end dans environ un an je me sens assez nerveux d'aller mon premier week-end sans que je laisse votre cerveau s'habituer à un emploi du temps spécifique,4
J'ai commencé à me sentir mal à l'aise et je me suis levé pour partir qui a été rencontré avec des commentaires de oh oui deux filles comme vous ne viendrait pas dans un bar si vous ne cherchez pas l'attention des gars,4
Je me sens paranoïaque mais aussi dégueulasse,4
Je me sens moins dérangé par ma grand-mère.,4
Je me sens juste un peu agité maintenant,4
Je me sens agité et désorienté.,4
Je me sens incertain de retourner à l'école l'année prochaine.,4
Je me sens ainsi effrayée au milieu de choses apparemment authentiques,4
J'irais aux fêtes de la maison rouge et je me sentirais vraiment coincée et socialement maladroite.,4
Je ne le fais pas si je me sens du tout effrayé et me supplie pratiquement d'éteindre ma musique punk hardcore,4
"Je me suis sentie en écrivant, je me souviens d'avoir eu l'impression d'être un goth plus jeune et d'avoir emménagé dans une nouvelle ville mélbourne après avoir passé des années à vivre dans un environnement rural.",4
Je me sens incertain de mes sentiments mes pensées,4
Je me sens confus pendant quelques secondes mon cerveau ne peut pas m'ancrer à un endroit géographique précis,4
Je me souviens m'être senti immédiatement alarmé.,4
ive s'est sentie agitée ces derniers jours,4
"Je me sentais trop timide pour répéter, puis j'ai dit que j'avais l'air d'une quarantaine de fois trente huit.",4
J'ai tellement peur.,4
J'ai peur de courir parce que j'ai peur des manifestants,4
Je me sens coincé ce matin.,4
Je pense qu'il est courant de se sentir impuissant à des moments comme celui-ci.,4
Je me sentais intimidé par tout ce territoire.,4
"Je me sens toujours un peu hésitant avec où je vais depuis que j'ai eu l'habitude d'échouer, mais c'est vrai toutes les choses que je voulais essayer d'atteindre i m aller pour",4
Je stresse sur son stress beaucoup trop parce que im pas tout à fait sûr comment communiquer professionnellement cette vibration me fait me sentir comme un chihuahua neurotique qui pissera sur ce tapis si il ya un mouvement soudain,4
Im hors de mon putain d'esprit et je me sens névrosé,4
J'ai commencé à me sentir mal à l'aise d'écrire en allemand,4
"Je me sens un peu agité, mon esprit se sent submergé d'un million de pensées.",4
après que mon petit ami m'ait battu pour la première fois,4
Je ne me sens pas vulnérable,4
Je me sens un peu tremblant beaucoup d'engourdissements et de tétons et mes jambes me font mal,4
J'ai l'impression d'avouer que Iive a 12 ans.,4
Je me sens bizarre.,4
Je me sens très désordonnée et frénétique aujourd'hui,4
Je suis fatigué de me sentir si anxieux et irritable tout le temps,4
J'ai l'impression qu'il est suspect et qu'il me teste.,4
Je ne connaissais pas un seul acteur donc je me sentais un peu mal à l'aise si im allait profiter de ceci,4
"Je décide de tremper mon orteil dans un autre genre, ça me fait un peu bizarre, ce qui est le cas de mon projet récent.",4
Je vais probablement passer par une de ces phases bizarres de nostalgie et de regret et tout ce que je peux penser d'autre est le passé et ça me fait bizarre et je ne sais pas quoi faire de moi-même.,4
Je me sens stressé par une sensation stupide,4
"Je déteste avoir peur, mais c'est probablement l'une des émotions que j'éprouve le plus.",4
Je pourrais me sentir vulnérable et un peu pitoyable mais j'ai la foi que cela va passer ne va pas se sentir merdique pour toujours et je ne devrais pas laisser ma perte de poids être affectée par cela parce qu'il va résoudre,4
Je me sens nerveux en disant ça mais ce qui est un exercice,4
Je conduisais des kilomètres pendant la journée et je ne me sentais jamais mal à l'aise.,4
Je me suis sentie agitée et pas tout à fait punie.,4
Je n'ai pas d'horaire ou d'amis d'enfance et je me sens un peu timide de sortir seul.,4
Je me sentais vraiment hésitante à propos de mon avenir ici.,4
Je me sens anxieux et ai du mal à dormir en plus de l'anxiété et de l'excitation au sujet de la course elle-même,4
Je crois que cela sera entrepris par Larry McCabe le greffier et c'est là que je me sens mal à l'aise.,4
"Je veux dire, si une femme marche seule la nuit traverser la route et marcher de l'autre côté de la rue afin qu'elle ne se sente pas menacée par vous",4
Je me sens un peu bizarre.,4
J'avais été cambriolée le soir précédent et m'étais jetée dans le ghetto comme une route sans issue pour trouver une sorte d'aide et de soutien dans le petit quartier des poubelles blanches pour me faire sentir moins effrayée.,4
Je peux me sentir différemment et être frénétique de passer assez de leçons,4
Je me sens un peu mal à l'aise avec certaines personnes de mon école.,4
Je me sens privée de toute indépendance et je me sens bizarre envers ma famille simplement parce que je vis ici.,4
Je m'assieds et je me souviens de ce que le désir ressenti et ce que le déni ressent comme il est si étrange de penser que je n'aurais pas pu changer ma propre perspective l'expérience elle-même a créé ma vision du monde,4
Je veux que ça me fasse me sentir un peu pétrifié.,4
J'ai l'impression que c'est une chose si vulnérable de dire oui que je ne suis pas si bon à ça et de le mettre là-bas dans le monde,4
Je peux vous assurer d'avoir eu une jeune vie qui m'a tellement détruite émotionnellement que j'ai tout simplement fermé à la fin de mon adolescence pour ne pas réapparaître comme un sentiment à part entière nerveux vulnérable si personne aimante jusqu'à des décennies plus tard,4
J'ai eu très peur quand un voleur est entré par effraction dans notre maison et a menacé de tuer mon père s'il ne s'est pas partagé avec un peu d'argent je regardais l'homme avec sa main sur la gâchette,4
J'ai traîné avec deux leo filles et ils aiment l'attention et ils se tiennent haut ampli dominant et je finis par être la tranquille qui se sent trop timide pour partager des mots,4
Je me sens paranoïaque que les gens disent des choses dans l'espoir que peut-être je ne ferai pas quelque chose ce soir,4
J'ai commencé à me sentir vraiment paranoïaque par rapport aux voyages,4
Je me sens anxieux dans cette situation,4
Je n'ai pas de très bonnes compétences relationnelles et je pense que tenter de remédier à cette déficience me fera me sentir moins stressé,4
J'avais l'habitude de me sentir si incertain tout le temps.,4
"Je ne connais pas la seule fille à ressentir ou être ça, mais je déteste être indécis",4
J'étais épuisée et je ne voulais pas vraiment me lever et me sentir très incertaine sur la façon dont la course allait descendre,4
Je combine le pneu plat la blessure à la tête et un oiseau sans tête qui se sent un peu paranoïaque,4
J'avais peur qu'il me tue s'il se sent menacé.,4
Et j'utilise tout cela comme un moyen de tout sortir et il n'a pas besoin d'être commenté ou quoi que ce soit son juste les déconnexions d'un autre adolescent dérangé,4
J'ai entendu des bruits de fantômes la nuit.,4
Je la sens dans cette situation je déteste vraiment les culpabilités alors elle accepte de se marier avec William mais pas sans lui infliger un visage de poisson indecisif et indécis sur le public pour plusieurs scènes,4
J'aurais aimé qu'il reste et quitte le monde avec plus de musique mais comme il se sentait torturé tous les jours je peux le comprendre,4
Je n'ai pas été mal à l'aise avec tout ce qui vient d'arriver je veux dire que j'ai la douleur occasionnelle des côtes et le haut de mon ventre s'endormant mais son tolérable,4
Je rétrécis autour de groupes de nouvelles personnes et me sens douloureusement timide et isolé ou parfois simplement ennuyé,4
Je me sentais sceptique et j'ai pensé le pousser pour des cils de marque Sephora,4
Je me sens plus réticente cette semaine que je ne veux pas m'arrêter.,4
"J'aime entendre parler de ministères qui s'adressent à des gens qui en ont besoin, mais j'ai une préoccupation à ce qu'ils puissent se sentir pressés d'excepter Jésus dans leur cœur en acceptant les soins des ministères.",4
J'ai récemment appris ça sur le sentiment d'être submergé alors j'ai pensé que je le partagerais avec vous,4
Je me sens un peu frénétique en essayant de trouver quelqu'un de nouveau,4
Je me sens mal à l'aise dans beaucoup d'aspects en ce moment.,4
"Je pense à mes insécurités et bizarrement, je me sens mal à leur sujet.",4
Je me suis réveillée très tremblante mais mieux,4
Je ne me sens pas pressé de perdre du poids en raison de la bonne cara delevigne regardé à la dernière vidéo secrète de victoria ou en raison de la bonne apparence de j lo dans sa vidéo la plus récente,4
Je me sens étonnamment instable.,4
Je pense que cela dépend encore de l'esprit ouvert de l'amant japonais que vous sortez mais la plupart d'entre eux se sentiront timides pour tenir la main en public,4
Je peux me détendre sans avoir besoin de réagir de manière inconfortable et sans les nerfs que je ressens toujours autrement,4
"Je me sens vulnérable, effrayée.",4
Je ne sais pas pourquoi certains ont toujours besoin de voix pour doigter leurs trous d'oreille.,4
Je parie que Kate est très gentille avec elle chaque fois qu'ils recommencent et qu'il l'amène quelque part et ça lui fait sentir vraiment bizarre de les voir ensemble et ensuite ils rentrent à la maison et ont des rapports sexuels intenses bizarres,4
"Je sens qu'au lieu d'être menacée en raison de la perte de sa virginité, je pense que cette femme a peut-être trompé l'orateur pendant leur mariage.",4
J'ai l'impression d'avoir l'air si bizarre dans les photos lointaines comparées aux photos rapprochées,4
Je ne pouvais pas m'empêcher de me sentir sceptique après que tout oli m'ait dit ça la première fois et que cela n'avait pas eu lieu aussi bien que je l'avais espéré,4
Je me sens timide de ma propre foi timide parce que c'est si étrange pour moi et je ne sais pas tout à fait ce que ça veut dire,4
Je choisirai de ne pas me concentrer sur lui au lieu de me concentrer sur ce que je ressens je vais essayer de ne pas me concentrer sur lui et au lieu d'être agité par lui je choisirai de laisser partir le sentiment négatif,4
J'ai fait en photoshop Je me sens un peu moins serré,4
Je ne sais pas ce que je veux faire de ma vie encore je me sens confus de ce que je devrais faire et aussi me sentir pressé d'être un adulte,4
Je me demande combien de temps je peux prendre soin de lui avant qu'il ait besoin d'aller dans une maison de retraite je me sens effrayée et une foule d'autres émotions,4
Je ne me suis pas sentie menacée ou effrayée entre la grande blancheur mais ennuyée,4
"im se sentant timide, puis agitant à la fenêtre et voila",4
Je me suis réveillée en me sentant un peu dépassée.,4
Je me sens effrayé avant que je sache que les actions que je fais dans ce corps de vie auront un effet sur l'issue de mon âme.,4
"Je ne sais pas exactement pourquoi, mais j'ai eu quelques moments de me sentir submergé non pas tellement à cause de benjamin mais à cause d'essayer de jongler le temps entre les trois gamins",4
Je me sens hésitant à m'en séparer et donc je l'ai gardé parce que c'est de la nourriture pour mes âmes,4
J'ai ce problème à me sentir mal à l'aise d'être dans ce genre d'endroit.,4
J'aimerais avoir une seconde chance de te revoir pour la première fois pour me sentir timide et nerveuse avec toi.,4
Je me sens plus paranoïaque maintenant que je n'ai jamais été proche Je peux le sentir,4
Je me rappelle que je me sentais vraiment dérangée pour quelques Noëls d'affilée après ça.,4
Je me sens toujours confuse et coupable pour tout ça.,4
"J'avais l'habitude de m'aventurer, mais aujourd'hui je me sens effrayée, je ne sens pas que je suis dans un pays libre qu'elle a dit",4
J'ai presque peur qu'ils se brisent quand elle bouge les mains,4
Je me sens bizarre de dire ça parce que je n'ai aucune idée de ce que je fais,4
Je me sens un peu effrayée par moi-même.,4
J'ai l'impression que cette infirmière hésite à savoir par où commencer mais optimiste que nous pouvons faire une chose pour aider,4
Je ne comprends pas la façon dont je me sens terrifié d'être mal bien je ne suis pas heureux et je ne suis pas fou êtes-vous écouter vous entendre tout se passe pour une raison rester clair changement d'amour,4
Je suis un sentiment un peu névrosé anxieux débordé et sur le point d'une crise de panique majeure,4
j'en ai assez de me sentir si mal à l'aise avec moi-même,4
"Je ne peux m'empêcher de sentir quelqu'un s'inquiéter des utilisations futures possibles de ces données et de ces dispositifs de suivi, en particulier, étant donné qu'un des principaux objectifs de ces expériences semble être de prouver que la chasse à la baleine commerciale devrait être relancée dans toute cette discussion sur la gestion des populations de baleines.",4
