text,label
Je me sens aussi si malheureux parce que je n'ai jamais eu de pause,0
J'ai refusé de me conformer et depuis que j'ai été sélectionné par lui et abusé en série ignoré et fait pour me sentir malvenu,0
Je ne peux même pas vous décrire ce que ça fait de souffrir d'une maladie qui menace la vie à quel point il est facile de céder et de répondre à ces coups de mort à la porte de votre vie,0
Je voulais qu'il se sente vraiment nul.,0
J'ai l'impression que la fin sera une bombe désagréable lâchée sur eux.,0
Je me sens coupable.,0
J'ai tellement de débordement dans mon cœur que je me sens comme tout ce que je peux faire est de regarder une page blanche,0
Je me sens une sorte d'insalubrité et fatiguée et j'ai un peu de mal de tête,0
J'ai l'impression d'être totalement vaine et tout sur moi-même après avoir regardé mes photos,0
Je ne peux pas arrêter de pleurer et je me sens juste sale,0
Je n'écris pas beaucoup sur la foi parce que je me sens comme presque tous les mots ont été abusés,0
"Aujourd'hui, je me sens comme cette boule de papier inutile jetée dans la poubelle.",0
Je suis tellement reconnaissante pour cette bénédiction que je porte maintenant que je l'ai fait autant que j'ai et je crois que je vais le faire plus loin et haïr que je me sens comme si je devais écrire une explication pour que les autres ne pensent pas que je suis ingrate,0
Je me sens émotivement drainée en ce moment,0
"Je me sens stupide que je n'ai pas fait la connexion plus tôt, mais je suis si heureux d'avoir maintenant",0
Je me sens abusé par rapport à Yentas filles affamées à mort afin de sauver des fils,0
Je me sens sale en regardant ces photos a écrit une affiche de forum à un href http www,0
J'ai l'impression que quelque chose s'est cassé en moi ce morceau de mon esprit qui était rempli d'espoir qu'au milieu des problèmes et de la douleur il y avait une solution cachée et j'étais déterminé à la trouver,0
Je faisais partie d'un groupe de jeunes et j'ai commencé à traverser certaines choses pour me sentir malvenue et n'avais nulle part où aller.,0
J'ai l'impression qu'ils n'aiment pas le mouvement.,0
Je me sens égoutté.,0
Je me sens gêné parce que tu as raconté de vieilles histoires sur moi à la fac.,0
"Je parle de ces choses, même si ça me fait flipper et déconcerter et tout ça trop révélateur.",0
J'ai l'impression d'être si ingrat parce que sérieusement tu n'as aucune idée de ce qu'ils signifient pour moi.,0
"J'ai l'impression qu'une approche pratique aide les élèves à comprendre que l'apprentissage de ces sujets ne doit pas être ennuyeux ou monotone, ils peuvent être intéressants et divertissants lorsqu'ils sont présentés de manière interactive.",0
Je me sens souvent comme une victime de traumatisme qui a subi un traumatisme après l'autre ou un boxeur battu,0
"Je frappe publier à la fin de tout cela je me sens comme un vol donné à tant de choses, que ce soit son bonheur, sa souffrance, son malveillance, son jugement, sa confusion ou sa colère",0
Je l'applaudissais à peu près à quelques mètres de l'arrivée comme un bon boulot bébé ramener à la maison n'importe qui d'autre se sentent vraiment boiteux applaudir pour les gens,0
Je m'inquiète pour ces filles et les femmes émotivement endommagées qu'elles deviendront inévitablement,0
Je suis en colère et émotive et je me sens tellement déprimée que je n'aurai pas ce sentiment de détente et de calme du cannabis,0
Je me sens aussi extraordinairement stupide d'être enceinte comme si j'avais fait quelque chose de mal.,0
"Je n'avais jamais vraiment pensé à la contamination croisée mais aujourd'hui je me sens plutôt léthargique et sous la météo, bien que je ne souffre pas encore de douleur heureusement",0
Je me sens assez découragé.,0
Je n'avais pas tenu jusqu'à ma fin du marché et il fallait donc me rappeler que je devrais me sentir coupable de vivre de son chèque de paie.,0
Je me sens un peu désespéré et ce n'est même pas le groupe de soutien aux écrivains peu sûrs.,0
Je pense que mon désir pour un partenaire romantique qui est physiquement en forme et a de gros muscles vient à la fois des médias américains et de ma propre histoire de se sentir non protégé par mes parents,0
Je pensais que si Greg me disait que j'étais belle alors je ne me sentirais pas si laid,0
J'ai vérifié et j'ai essayé de comprendre pourquoi id se sentait si merdique hier et aujourd'hui,0
Je ne me sens jamais seule.,0
Je l'aime parce que je sens qu'elle est réelle dans une compétition qui a commencé à paraître de plus en plus fausse,0
Je me sens très isolé et usé,0
"Je me sens un peu mal pour Hector, mais je me demande s'il pense qu'on l'aime mieux.",0
J'ai l'impression qu'ils ont été victimes d'une équipe d'officiers qui a eu quelques appels très mauvais et qui a vraiment affecté le résultat,0
Je pense à la façon dont les femmes âgées sous-diagnostics ont été au cours des décennies je me sens juste triste que personne ne gagne quand on s'accroche à l'idée de troubles de l'alimentation comme étant le pays de la classe moyenne supérieure adolescent blanc,0
J'ai eu une conversation avec une amie qui m'a vraiment fait peur et qui m'a laissé engourdie émotionnellement.,0
Je me sens très merdique que certaines personnes me manquent encore à minuit.,0
Je me sens si faible qu'on a renoncé à quelque chose et on ne peut pas abandonner des points.,0
Je ne veux jamais vraiment me sentir comme un gaspillage d'espace sans valeur personne je ne peux toujours retourner à Washington,0
Je ne peux pas me sentir en paix dans ma maison désordonnée et la vie semble changer de beaucoup de petites manières.,0
Je me sens tellement léthargique en ce qu'il n'y a pas de précipitation première chose,0
J'ai l'impression qu'on a raté quelque chose.,0
Je ne me sens pas groggy et léthargique après avoir bu ce shake donc je suis un peu plus alerte pendant la journée,0
Je peux sentir une bosse dans mon pied douloureux,0
ive a toujours été convaincu qu'il y a quelque chose dans mon visage que les gens n'aiment pas et je me sens toujours très malvenu,0
J'ai l'impression que Todd est trop stressé ou fatigué avec Caleb je vais le prendre parce que je ne veux pas que Caleb sente cette frustration,0
Je suppose que Miley le sait mais je ne peux pas arrêter de sentir le coeur brisé pour elle,0
J'ai l'impression d'avoir raté le bateau.,0
Je me sens comme une poule produisant des œufs pourris de toute façon il a dit que nous devrions dire à d'autres personnes ce que nous avons appris ce qui est coïncidable ce qui a été fait torturer les gens avec des bouts aléatoires de trivia des choses que j'apprends,0
im dans le bain nu avec un autre homme sur le téléphone se sent mal à l'aise hoche ma tête et pense comment puis-je récupérer mon pantalon sans faire des bruits d'éclaboussure,0
J'étais dans ma voiture en criant dans la douleur et comme s'il ne venait même pas me voir pour voir si rien ne me faisait me sentir si impuissante que c'était un putain de cauchemar,0
Je sais que j'en ai été affecté et que l importance de la beauté est si profondément ancrée en moi que je ne pense pas que je cesserai jamais de me sentir inadéquate d'une certaine façon pour ne pas mesurer à la société une vision étroite et inaccessible de la beauté,0
Je me sens sérieusement comme un poids mort sans valeur que tout le monde serait mieux sans que je n'ajoute rien de positif à l'expérience de quelqu'un et tout ce que j'entends des gens c'est comment je baise ou ce que je devrais faire mieux comme je suis juste cette personne sans valeur brisée flottant le long,0
Je ne devrais me sentir vaincu que si je mangeais du gâteau et de la crème glacée tous les soirs et n'essayais pas de gérer mon diabète gestationnel,0
Je leur ai dit que je voulais des cartes cadeaux pour acheter de la musique sans me sentir coupable.,0
im se sent toujours très émotif et fragile mais ive m'a tenu occupé à remanier mon site Web et à doodling beaucoup,0
Je me sens ingrate parce que j'ai cinq enfants incroyables,0
Je me sens toujours mal à l'aise dans la plupart des situations sociales je trouve toujours difficile de faire et de maintenir des amitiés et je dois lutter fort contre l'envie de rester enfermé à la maison et ne jamais aller nulle part autre que l'épicerie,0
J'ai l'impression d'avoir échoué au travail ma vie personnelle est en désordre et tout se sent tellement incontrôlable,0
Je crois que je me sens stressée.,0
Je me sens troublée de me laisser dormir pendant cinq minutes et je peux jouer,0
J'ai trouvé que je compte mes bénédictions plus souvent ampli se sentent comme une maison sale ou une montagne de lessive n'est pas effrayant,0
Je ne veux pas l'attention et en partie juste parce que je me sens stupide,0
l'impression d'être refoulée à nouveau ha,0
J'ai l'habitude de le passer assis à la maison en me sentant merdique.,0
ive m'a fait mal récemment par diverses personnes et événements,0
J'ai passé par divers aspects de la croissance personnelle en pensant philosophiquement à beaucoup de choses différentes ce que je veux des relations ce que j'attends et mérite d'autres personnes étant faites pour se sentir dans le besoin ou désespéré pour des attentes assez standard ce genre de chose,0
Je me sens sentimental à propos des paniers d'est et des chasses aux œufs,0
Je me sens mal à l'aise de rentrer à la maison à pm c'est encore un super programme,0
"J'ai l'impression d'avoir été un peu nul à ma fin, mais je me suis bien débrouillé avec mes lectures bibliques et mes dévotions.",0
Je sens les griffes s'enfoncer plus profondément dans la chair interne non protégée,0
Je ne sais pas non plus que je me sens triste et désolé de gronder u,0
Je me sens tellement déçue par mon travail et j'ai passé les trois derniers après-midi à me défoncer et à jouer à l'araignée solitaire parce que je ne peux plus m'emmener au cul si dur.,0
Je me sens punie pour l'avoir trouvée si divertissante.,0
Je ne me sens pas aimé et manque d'amour et comme je souhaite qu'il puisse m'embrasser de nulle part et dit bébé je t'aime toujours,0
Je ne l'ai pas mis à jour en tant que célibataire parce que j'avais ce sentiment d'intestin que je serais célibataire pendant longtemps et je serais boiteux,0
"ne coupant pas son tout horriblement sur mes cuisses juste un tout petit sur mon poignet afin que ce ne soit pas comme je vais mourir, mais je me sens extrêmement déçue par moi-même de le faire",0
Je faisais une scène avec elle et elle courait des lignes avec moi elle ne dirait jamais oh j'ai l'impression que tu devrais faire blanc utiliser des termes de film ou quoi que ce soit,0
J'ai dit à l'officier que je souffrais de ptsd et que je me sentais abusé par cet abus déclenche le ptsd et je ne peux plus écouter ce qu'ils ont à dire,0
Je me sens totalement défectueuse,0
Je me sens très perdu Je me sens très perdu un href http themadjewess,0
Je me sens si dévastée que la flamme olympique est partie sur clic pagetracker,0
J'ai aussi eu une application ortho dans le am et je me sentais un peu merdique,0
J'ai l'impression d'être blâmé pour tout son stress parfois.,0
Je suppose que c'est le besoin très humain de ne pas se sentir complètement idiot en validant un point de vue via les autres,0
Je me sens vide parce que cet endroit ne se sent pas vraiment comme chez moi mais je suppose que je ne sais jamais,0
J'ai toujours l'impression que chaque décision qui se passe mal est imputée au jonathan.,0
Je ne me sens pas seul même si je suis isolé,0
Je me sentais toujours dans le besoin et je voulais passer plus de temps avec elle et gérer les insécurités et bien l'accent sur ce que mon amie faisait,0
Peut-être que je ne me sentais pas encombrée.,0
J'étais tellement excitée et c'est arrivé au moment parfait où je me sentais un peu mal au pays,0
Je me sens déprimée et j'ai presque envie de me suicider.,0
"Je me sens juste affreuse, peu aimable et profondément désolé pour moi-même.",0
Je me sentais assez découragé ce week-end parce que je n'ai absolument rien fait qui puisse être considéré comme nichant,0
J'étais engourdie et détachée me sentant seule et isolée dans cette nouvelle terre et manquant terriblement tous les gens et les lieux laissés derrière,0
"Je ne m'attendais pas à me sentir si découragé par son départ, mais je le fais vraiment vraiment.",0
Je pourrais me sentir isolé du monde.,0
Je pense que ces yeux n'ont qu'à me regarder parce qu'ils ont pitié de mes gestes pathétiques.,0
Je me sens mal à l'aise et bizarre quand je le fais.,0
Je suis fatigué de lutter financièrement et de me sentir coupable parce que je ne travaille pas,0
Je me sens complètement sans valeur parce que hey maintenant n'importe qui peut être sa mère,0
Je me sens tellement honteux que je n'ai rien apporté en tant que jeune.,0
Je me suis réveillé ce matin me sentant vraiment merdique à propos de moi-même parce que j'ai juste terminé un rêve non sexuel avec George clooney,0
Je peux sentir l'affreux crash de la surcharge de sucre que je me suis donné avec le ballonnement des mauvaises graisses de gluten et des ordures générales qui vient avec tous les aliments transformés,0
J'étais égoïste et je me sens tellement horrible à ce sujet.,0
J'ai l'impression d'être boiteux et même de mettre n'importe quoi là-dessus son jus iv a été hors du jeu de rencontres pendant un moment essayer de me concentrer donc jus im jus essayer de s'assurer que je ne rate pas n'importe quels indices étant jetés à ma manière lol,0
J'ai l'impression d'un échec aujourd'hui j'ai raté la vie d'amis de carrière sont tous partis ils sont allés à un endroit où il y a de meilleurs revenus et moi bien moi je suis toujours ici dans notre village coincé,0
"Je me sens dérangée comme si ces gens commettaient d'horribles crimes, mais pourtant, il faut marcher dans les rues tous les jours et voir la lumière du jour.",0
Je dois dire que cette fois je me sens un peu engourdi,0
im debout dehors sur le porche avec un livre je ne peux pas régler mon cerveau vers le bas pendant deux secondes pour lire une cigarette qui est en train d'être fumé trop rapide et une profonde sensation de mécontentement qui s'installe dans le fond de mon estomac comme des pierres,0
im va toujours écrire quelque chose ou mal se sentir négligent,0
Je me sentirais mal pendant un moment mais il y avait de l'espoir,0
J'ai eu un jour pas si fabuleux plus tôt dans la semaine et je me sentais vaincu dans mes compétences,0
Je vis depuis des années mais je sens que j'ai vécu en vain Je suis plus fort que quand je n'étais pas beaucoup d'autres gens semblent avoir réussi seulement je n'étais rien bien que je sois soigneusement réussi peut-être que je n'ai pas échoué comme les autres mais je pense juste jaloux,0
im à ce moment où im encore encombré et se sentir malheureux mais s'attendre à être meilleur à tout moment maintenant,0
"Je me sens honteux d'avoir admis cela, j'aimerais juste que le parent donne un coup de pied à la boîte avant que je doive faire un voyage en famille au centre-ouest.",0
Je me sens extrêmement morose et désespérée contre moi-même incompétent dégénéré,0
Je me sens mal pour lui depuis qu'il n'est qu'un pion,0
Je peux te sentir engourdie maintenant je peux te sentir engourdie maintenant je peux te sentir engourdie maintenant je peux te sentir engourdie maintenant mais tu ne peux pas le sentir te faire,0
Je me sens tellement désespérée.,0
Je me sentais assez déçue par tout le truc de la femme au foyer et j'avais besoin d'inspiration.,0
J'ai vu Alex s'inquiéter pour Ryan et se sentir si impuissant parce qu'il ne pouvait pas effacer le mauvais,0
Je continue à regarder quand Jamie commence à parler au nouveau gars en portugais avant qu'il ne m'appelle et je me sens terrible que je ne lui ai pas offert de l'eau ou quoi que ce soit et j'ai juste mis ma main sur ses épaules toujours impatient de tenir sa main au poste de police,0
Je me sens un peu consterné en considérant le dialogue rageux sur le contrôle des armes à feu le droit de posséder et de porter des armes les soins et le traitement des personnes les plus vulnérables dans notre société la stigmatisation continue de la maladie mentale et certaines des solutions proposées à la récente vague de violence contre les armes à feu cette année,0
Je me sens mal que ma toute première signature le samedi j'ai oublié d'offrir au jeune garçon et sa mère un croquis j'ai signé des copies de l'annonce pour vous et vous a montré un aperçu de l'aquila donc si c'était vous s'il vous plaît laissez-moi un commentaire ou email et mal vous envoyer un croquis,0
"Je travaille aussi à plein temps, mais je me sens encore un peu boiteux.",0
Je me sens peiné quand je suis trahi par des gens à qui je crois que j'étais vraiment lié.,0
J'ai commencé à me sentir mal au pays et nauséabonde à l'occasion des opportunités et amis id laissés derrière quand le petit ami susmentionné n'a pas en fait attendre pour moi et je n'avais pas d'amis avec assez d'histoire et d'investissement pour m'aider à travers le coeur brisé je me suis enfui à nouveau,0
"J'ai l'impression que même si ça semble être une année ennuyeuse pour même la peine de bloguer, mais puis à nouveau le temps a volé si vite que je me souviens à peine d'une merde",0
Je me sens toujours un peu stressée aussi.,0
J'ai l'impression d'être très ingrat si je n'étais pas heureux d'être ici.,0
Je me sens un peu battu ce qui est en fait un sentiment agréable,0
"Je n'ai pas dit qu'il était mauvais ou qu'il m'avait soigné mais après quelques mois de sexe, j'ai commencé à me sentir sale et utilisé",0
Je me sens parfois sentimental à leur sujet avant qu'ils ne se terminent.,0
Je n'ai pas l'impression d'avoir manqué la magie d'être publié,0
Je suis désolé pour lui.,0
Je l'ai laissé continuer sans aucune protestation qu'il m'avait fait me sentir si soumise et impuissante,0
Je dis que je me sens seul Je ne veux pas dire qu'il y a,0
Je me sens mal à la maison ces derniers jours.,0
Je me sens vaincue Conflite pauvre solitaire rejetée non appréciée perdue,0
J'ai l'impression qu'il semble que la plupart des mauvais sentiments que j'ai vécus avant ont été remplacés par des maux de tête cette semaine.,0
J'ai trouvé ce produit dans ma boîte de beauté dit le mois dernier et quand je me sentais plutôt merdique la semaine dernière j'ai décidé de le creuser et de l'utiliser,0
ive a eu ce sentiment bizarre depuis que j'ai rompu avec Katelin,0
Je me sens endommagée,0
Je me réveille en sachant qu'elle se sent mal me réveiller comme ça au milieu de la nuit et qu'elle ne serait pas là si quelque chose de sérieux ne se passait pas,0
Je me souviens me sentir extrêmement embarrassé mais je ne voulais plus que l'attention soit portée à l'incident et donc je n'ai pas parlé avec un adulte,0
J'avais l'habitude de me demander pourquoi les gens de ce monde se sentent si isolés,0
"Je n'ai pas autant de courage à me plaindre de ça et pour la première fois, j'ai honte de ne pas avoir ce courage.",0
Je ne sais pas quel est mon problème et il me tue à l'intérieur que je me sens privé,0
Je manque le sentiment d'un estomac vide quand j'essaie de dormir le sentiment d'avoir un secret sombre que personne ne connaît le sentiment d'accomplissement quand vous voyez ce nombre sur l'échelle qui prouve votre travail dur paie,0
Je ne peux m'empêcher de me sentir un peu consterné par le fait que ce casting de milliers d'affaires est confirmé par un jeu que je me souviens si vivement pour toutes choses son sens de la retenue,0
Je peux sentir que ces blessures sont sous ma poitrine frapper et douleur,0
Je me sens encore un peu brisé le coeur,0
Je me sens tellement remords seul pécheur incertain et non concentré la plupart du temps,0
J'ai l'impression d'être puni pour avoir été un salaud paresseux pour ne pas cuisiner par les supermarchés qui ont des annonces qui rendent les vomissements projectiles agréables,0
J'ai l'impression que les gens peuvent parfois être embarrassants et râpés sur les vidéos alors id plutôt épargner leur embarras et les laisser réfléchir à travers les choses en écrivant,0
ive a vraiment eu de la chance avec le sentiment qui a été le plus dans le besoin,0
Je me suis sentie vraiment cassée ces derniers temps.,0
Je me sens un peu consterné par le fait que j'ai deux enfants la réponse est oui au fait,0
ive a fait tout ce travail sur moi-même a beaucoup de compétences et d'outils à ma demande et appelle à me garder heureux paisible quoi que ce soit et imm se sent léthargique et à bas,0
Je veux me sentir stressé que je ne veux pas l'ignorer et le faire apparaître plus tard,0
"J'ai promis à moi-même que si Dieu le veut quand je serai grand et que j'aurai une famille à moi, je ne laisserai jamais aucun de mes enfants être intimidé se sentir ignoré et non aimé",0
Je n'en ai pas senti un que je viens de dire que c'était très malheureux pour lui et que tout arrive à chacun d'entre nous exactement comme il devrait,0
"Je n'ai pas demandé beaucoup de questions sur ce qui s'est passé, mais je crois qu'il l'a fait pendant ce temps tout ce que je peux penser est Dieu ne laisse pas cela être nous comme je me sens si mal de penser cela et de le dire aussi bien",0
Je finirais par me sentir très découragé.,0
J'ai commencé à me sentir vraiment découragé.,0
Je me sens parfois et je pense que je continuerai à sentir pour le reste de manger tout ce que vous pouvez je me sens un peu désolé et indigne,0
"J'ai constamment l'impression de prouver quelque chose à tout le monde, mais je n'ai jamais réussi",0
Je me sens ingrate si je laisse mon esprit errer loin de lui s état de bonheur pour même une seconde,0
Je me sens quand j'ai commencé à écrire de façon unique malvenue je savais comment je voulais que les trois premiers livres aillent,0
ive a remarqué que ive n'était vraiment posté que quand je me sens vraiment merdique et a besoin d'un endroit pour évacuer,0
Je le fais et tout le temps je me sens complètement sans valeur,0
"J'ai lutté tant de fois et je me sens battue. Je me sens comme si je devais abandonner, mais elle est trop importante pour abandonner.",0
Je ne me sens pas déçue en moi-même.,0
Je ne sais pas quand je vais lui dire et me sentir coupable et déçu que tout ce que je pense d'elle et de notre relation en ce moment est négatif,0
im manger et aussi pourquoi im se sentir si pourri sur les calories,0
j'en ai assez de me sentir ignoré tout le temps alors j'ai arrêté d'appeler les e-mails cessé d'envoyer des textos,0
"Je ne peux m'empêcher de me sentir déçue par la façon dont le collège ou l'université est considéré comme l'apogée de ces réalisations quand, en fin de compte, ce papier ne prouve rien à la personne que vous êtes vraiment",0
Je priais avec un cœur lourd l'autre jour et je criais à Dieu en disant que je ressens tout ce poids et la douleur mais dieu je ne te sens pas,0
"Je dois te le dire pendant un moment, je me suis sentie triste et condamnée et des nuages gris laids se sont accrochés autour de moi.",0
d'habitude se sentir très vide et je sais que j'ai déjà posté aujourd'hui mais c'était tout bachelorette parler et je suppose que j'ai eu plus à dire,0
Je me sens bien mal au pays ce week-end,0
Je me sens perdu dans ma propre vie,0
Je ressens pour tous mes potes à Cleveland d'avoir à regarder une autre saison de foot merdique,0
Je me sens aussi honteuse de la façon dont je fais peu dans la maison peut-être si je me sens mal enuff je vais faire quelque chose,0
Je veux m'enfermer dans ma chambre et ne pas avoir à me sentir humilié à cause de mes propres pensées et des jugements des autres.,0
J'ai le bon sentiment que ive a manqué sur certains ici mais ce sont des choses qui ne sont pas impossibles à faire,0
Je me sens vraiment boiteux parce que je n'ai toujours pas lu le roi de fer s'il vous plaît ne me tirez pas dessus,0
Je me sentirais toujours tellement émotivement drainée et affreuse alors j'ai tenu à ce sentiment et je me suis concentré sur elle chaque fois que je suis allé prendre le téléphone,0
J'ai l'impression de pouvoir enfin dire ces choses sans craindre d'être puni par un vieux dieu testamentaire jetant des boulons de tonnerre et des boules de feu contre moi pour blasphème,0
J'ai l'impression d'être punie pour les avoir aussi.,0
J'ai l'impression d'avoir besoin d'un faux personnage pour que les gens m'aiment.,0
"J'essaie de ne pas laisser cela devenir quelque chose de mieux adapté à l'autre journal, mais je me sens tellement sans liste",0
J'ai le sentiment qu'elle ne va pas permettre à son père de lui mettre ce chapeau laid pour beaucoup plus longtemps,0
Je me sens mal au pays le meilleur remède est de faire des bijoux qui me rappellent ma maison,0
Je me sentais ignorée ou mes compétences en tant que guérisseur d'alt étaient vraiment sous-estimées.,0
Je me sens un peu inhibée d'écrire mes vrais sentiments en elle maintenant,0
"J'ai essayé de parler à mon amie de tout l'accord et d'après ce qu'elle dit, j'ai compris qu'elle ne semble pas vraiment se soucier de ce que je ressens ou de vouloir mettre tout en œuvre pour passer du temps avec moi à faire des choses que nous aimons faire ensemble, elle semblait être résignée.",0
Je me sens tellement réprimé parfois au café féérie,0
si bas dans le sentiment de malvenu que je n'ai même plus envie de taper,0
