text,label
Je ressens ce désir pour son darshan,2
Je ne me sentais pas si chaud.,2
"Je l'explique ce pourrait être une façon de sentir notre proximité que seuls ceux impliqués peuvent comprendre, mais comme c'était un très bon sentiment, j'ai commencé à aimer gackt",2
J'aime donner des cadeaux quand je me sens généreux,2
J'ai l'impression d'être l'un d'entre eux qui soutient encore non,2
"Je suis excitée de voir le progrès, mais je me sens déjà nostalgique pour mon bébé rampant.",2
J'ai un sentiment de malaise en n'utilisant pas l'accusé je suis fidèle à eux mais pas cette fois,2
J'ai l'impression que mon cœur veut qu'elle tombe amoureuse.,2
Je me sens aussi squatter qu'une moche avec elle qui me soutient.,2
J'ai l'impression que mes professeurs et mes conseillers seront très solidaires et m'aideront à réaliser ce que je veux.,2
Je ne peux pas supposer que c'est universellement vrai que la plupart des femmes qui ont pensé à poursuivre et ou qui sont dans le ministère ou les domaines religieux comprennent les obstacles aux murs qui s'opposent au sentiment que nous sommes pleinement acceptés ou acceptables en tant que membres du clergé.,2
Je me sens affectueuse et protectrice envers ces voyageurs,2
J'avais l'habitude d'être une personne ouverte partageant des sentiments d'être gentil donner loyal et chaque fois se faire arnaquer,2
Je suis reconnaissant pour nos deux chiens qui peuvent toujours me faire sourire et me sentir aimé,2
Je me sens tout énergisé et a eu le doux rappel du plus grand perdant que parfois même si votre nourriture n'est pas parfait exercice simple vous aidera à atteindre vos objectifs im donner celui-ci loin,2
J'ai commencé à ressentir maladroitement un peu d'affection tendre amour à l'égard de laquelle la non-cutée,2
Je ne peux vraiment que dire que je sens que je suis passionné par l'enseignement,2
Je voudrais boire de l'eau sans me sentir comme si elle allait monter ou manger une pomme ou un sandwich sans qu'il goûte trop sucré ou trop salé,2
je me sens assez généreux prendre pendant que vous pouvez l'obtenir,2
Je voulais bloger aujourd'hui mais je ne me sens pas si belle a décidé de faire quelque chose qui ne m'implique pas prendre des photos de quelque chose de soo,2
Je sais que ça fait un moment que je ne suis pas sur blog et je pense que je devrais m'excuser auprès de ces fidèles qui vérifient ma page de temps en temps.,2
J'oublie qu'il peut s'agir d'une lutte quotidienne pour se sentir accepté par les autres.,2
Je peux me détendre plus profondément en me sentant aimé et soutenu,2
Je me sens vraiment nostalgique quand je pense à combien de choses drôles sont arrivées ce jour-là,2
"Je sais que vous n'avez peut-être pas envie d'être affectueux avec lui en ce moment, surtout quand il agit comme un chacal, mais essayez-le.",2
"Je dis mes sentiments, mais vous ne vous souciez pas de ceux-là.",2
J'aime le sentiment causé par la connaissance d'être admiré par les yeux noirs affamés,2
Je ressens vraiment le besoin de poster pour les lecteurs fidèles de ces photos qui ne sont pas pour un comp,2
J'ai l'impression qu'elle n'a pas vu d'étincelle romantique à travers de nouveaux yeux ces derniers temps au moins elle ne prend plus sa dévotion pour acquise,2
J'ai toujours pensé aimer certains était le plus grand sentiment mais j'ai réalisé que aimer un ami est encore mieux v perdre ppl v amour mais v jamais perdre de vrais amis,2
Je ne peux pas expliquer que mon âme n'est pas blessée mais je sens la douleur qu'elle est comme je l'ai accepté je ne peux pas le faire mais je suis à nouveau testé ampli,2
Je me sens passionné par le partage non pas un dogme mais une logique acausale de toute façon principalement je fais de mon mieux pour me concentrer sur elle purement comme une expression d'exercice personnel et de plaisir,2
Je me sens comme une actrice de soutien,2
J'adore utiliser un nettoyant mousseux à cette période de l'année et j'ai trouvé qu'un peu de ce nettoyant va un long chemin et qu'il se sent en fait assez hydratant et doux sur la peau,2
Je me sens passionnée et excitée par ça.,2
Je me sens béni d'avoir rencontré Scott,2
Je me souviens qu'il a dit séduisantement d'une voix profonde me faisant me sentir si chaud et dérangé,2
"J'ai été séparé d'eux, je me souviens encore combien ça m'a fait sentir d'être aimé.",2
Je me sens tellement excitée que je ne peux pas durer un jour sans mouiller ma chatte avec mon jus d'amour,2
Je suis tellement derp mais j'ai l'impression que peut-être les gens n'aiment pas vraiment ma musique ils sont juste en soutien,2
J'ai l'impression que quelqu'un est toujours sur le pas coquin,2
J'ai l'impression que Dieu nous rappelle que nous faisons des progrès,2
"J'ai fait ce que j'ai pu, mais je voulais que mon mari sente que je le soutenais.",2
J'ai l'impression que le traitement BW ajoute à l'effet délicat,2
im in scarborough et se sentant nostalgique,2
Je me sens toujours un peu plus délicate en eux comme s'opposant à ce que je me sens normalement comme un taureau dans une armoire en porcelaine,2
J'ai l'impression d'être vilain et de manger mal,2
Je me sens tout romantique avec des Valentines qui arrivent,2
"Je me sens généreux ce soir, alors je pense qu'im va lui faire un massage et la mettre en forme pour une séance du soir.",2
J'ai ressenti beaucoup de sentiments positifs en priant et je prévois de prier chaque fois que j'ai besoin de moi-même pour les êtres chers et pour quiconque a besoin d'énergie positive,2
J'ai toujours un noeud dans le bas du dos gauche et je me sens toujours tendre mais j'avais vraiment besoin de retourner à la salle de gym,2
Im sentiment comme ils ont nivelé quelque chose de beau et l'ont remplacé par une pâle imitation complète avec la faune d'étain,2
J'ai l'impression que le type qui aimait ça depuis l'an dernier m'a été enlevé.,2
mal faire cela en l'aimant à travailler dur sur nous et à la vie en s'assurant qu'il se sent aimé chéri et confiance,2
Je ne me sentais pas accepté par les chrétiens et j'ai vu tant d'égoïsme et d'hypocrisie,2
Je me sens parfois comme si je passais mes jours avec éponge et patrick envie de sophistication,2
Je pense qu'on ne devrait pas être attentionné envers les personnes âgées et être inconsidéré et jeter ensuite dehors,2
J'ai commencé à le suivre au début pour deux de leurs modèles kitagawa keiko et azama mew mais puisqu'ils sont tous les deux partis maintenant je ne me sens pas nécessairement fidèle à dix-sept bien que j'en profite encore,2
J'ai l'impression qu'on a une belle relation d'écriture de lettres.,2
J'ai l'impression que les gens que j'aime vraiment me laissent tranquillement,2
"Je me sens un peu délicate, malade et triste",2
Je me sens à propos des femmes chaudes,2
J'ai même eu le temps de faire des freebies la semaine dernière car je me sentais très généreux,2
J'ai juste envoyé un message à un ami pour dire que ça ressemble à de la justification alors j'ai réalisé que ce qu'il justifie le plus est de prêcher au choeur puisque Jezebel est évidemment une communauté sympathique,2
Je me sens comme im dans un poêle chaud pendant longtemps,2
Je me sens extrêmement excitée et ça me rend extrêmement crapule,2
im ne se sent pas tout à fait aussi sur les choses que j'aurais aimé mais im se sent toujours assez à l'aise dans ma conduite,2
J'ai l'impression qu'être fidèle à vos amis est un des aspects les plus importants de l'amitié.,2
Je me sens entièrement accepté,2
Je m'attendais en partie à obtenir ce sentiment que parfois vient de lire quelque chose que vous avez écrit dans le passé sur quelqu'un que vous avez aimé,2
Je peux encore sentir mes doigts et penser oui je pourrais en fait porter ces chaussures pendant quelques heures de plus ce sont les récompenses douces pour toutes les préparations épuisantes,2
Je pense que votre relation romantique pourrait être améliorée avec les conseils que j'ai partagés précédemment,2
Je ne me suis pas senti si chaud ces derniers temps.,2
Je ressens John bien-aimé je souhaite au-dessus de toutes choses que tu puisses prospérer et être en santé comme ton âme prospère,2
"J'aimerais pouvoir y retourner et au moins le rencontrer en personne, voir ses doux petits yeux ouverts pour le sentir bouger dans mes bras au lieu d'entendre ses doux petits cris et ses petits coqs",2
im si paresseux avec hydratant mon corps après une douche et son fou parce que j'ai une peau si sèche que j'ai exfolié et mositurisé pour bébé peau douce et il se sent beau,2
J'ai l'impression de mourir d'envie de dents douces.,2
Je viens de perdre mon ipod nano si imm me sent un peu nostalgique,2
Je me sens vraiment coquine et un peu coupable parce que je sais à quel point c'est mauvais mais ive l'a déjà fait deux fois,2
Je ressens vraiment mon manque de confidente et mon besoin d'un groupe d'amis qui sont en fait au même endroit que moi,2
J'ai l'impression de remarquer des opportunités plus souvent romantiques et autrement,2
J'ai juste l'impression que parfois quand un acte chaud se blesse bryan ou cm punk ou que les choses prennent un plongeon financièrement le wwe retourne au statu quo cena comme champion,2
"Je me sens un peu nostalgique ce matin, mais pas pour mon ancienne maison.",2
"Je ne pensais pas que l'incident était drôle alors je n'ai pas souri, mais je me suis trouvé à regarder dans l'arbre comme si je voyais ces pommes sur cet arbre pour la première fois",2
Je veux toujours qu'elle sente mon front et qu'elle m'apporte du thé noir doux,2
Je ne sens jamais votre baiser tendre à nouveau span style webkit taille de texte ajuster auto webkit course de texte largeur px fond couleur blanc affichage couleur inline,2
Je me sens excitée sans raison particulière,2
J'ai marché seul en sentant le plaisir des derniers rayons du soleil doux du ciel bleu translucide déjà touché par le froid proche du bruissement des feuilles tombées sous mes pieds,2
"ive a même vu quelques épisodes, mais je n'ai pas de sentiments forts à ce sujet d'une autre manière que de prendre soin parce que je sais que sa mère a été récemment diagnostiquée avec als",2
Je me sens si belle a eu une longue journée de dessin et maintenant a juste eu une petite douche dormante,2
Je sais que mes mots te feront sentir que je suis une personne passionnée et que tu viendras à comprendre moi et mes veiws en lisant mes messages,2
"Je ne suis pas normalement le genre de personne qui devient émotive lors de la rencontre d'une figure publique, mais aussi étrange qu'il semble vous voir hier pour la première fois que le sentiment est venu sur moi était le sentiment que l'on pourrait sentir en voyant une tante préférée aimante lol",2
J'ai fait ces petites observations et j'ai l'impression que c'est le moment d'être un peu plus attentionné pour lui et de l'aider.,2
Je me suis souvent senti nostalgique pendant l'année alors que les moments se produisaient,2
J'ai commencé à sentir un point chaud au fond de mon pied et j'ai pu dire que j'allais avoir une vésicule méchante.,2
Je sens que dans un il ya un sens de kenya ouvertement interagir soutien shiraishi au lieu de se produire juste à pat shiraishi sur l'épaule,2
Je me sens d'une manière aimante,2
Je me sens nostalgique ici sont mes arbres de la leçon deux que j'ai fait avec Barbara,2
Je ne peux pas imaginer ce que sa femme pense ou ressent de lui être plus jolie et salope qu'elle et avoir l'air plus jeune qu'elle ne fait un href http s,2
J'ai l'impression que le fait qu'il soit narrateur n'est pas aimé est tout dans sa propre tête,2
Je pense qu'il a un si beau message et un si beau but et se sent si heureux d'être séparé de ceci,2
J'ai vraiment le cœur fixé et donc comment cela influence à quoi ou qui je me sens le plus loyal,2
"J'ai l'impression que si Eden n'était pas si dévouée à Ryan, je n'ai aucun problème avec son approche de ce personnage.",2
im ne va pas aller dans le complot du livre que je me sens pour donner un résumé fidèle nécessiterait des pages et des pages et puis encore laisser dehors des choses importantes,2
J'ai eu un sentiment de malaise à propos de choses que j'aurais aimé lui dire une seconde mère à moi même si elle était déjà morte,2
Je suis arrivé là-bas je ne pouvais pas secouer le sentiment que bien que j'étais encore cette amie aimée je n'étais pas la bienvenue,2
J'ai parlé avec mon petit ami de mes sentiments à propos de tout et il est extrêmement favorable,2
Je suis une paire de jeans essayé pour la taille et l'apparence et se sentir encore et encore accepté et nié,2
Je ne me sens pas gracieuse,2
Je pense que je devrais partager avec flickr plus sur les choses qui se passent parce que vous avez tous été si solidaires,2
J'aime beaucoup ça.,2
Je me sens plus comme un gâchis chaud qu'une femme sexy,2
"Je me sens sympathique, je n'ai pas honte de dire ce qui suit à l'homme qu'il se sent grand être dans l'autre",2
im en fait se sentant très nostalgique pour un temps qui n'a jamais vraiment existé en ce moment qui est bizarre,2
J'ai l'impression que je n'ai aucune idée d'où im va désirer pour le matin l'obscurité pour vaincre je veux tellement être hors de cet endroit sombre,2
J'aime sentir cette petite vie en moi que Luc et moi avons créé mais j'ai aussi hâte d'embrasser son doux visage et de dire son nom,2
"Je ne pouvais plus identifier la séparation entre mes mollets et mes pieds, mais assez pour que mes pieds et mes orteils se sentent chauds et serrés et que mes flops commencent à laisser des indentations dans ma peau.",2
J'ai dû aller à l'infirmière de l'école il me connaît très bien puisque toutes ces fois j'ai été là et il me demande toujours comment je me sens très doux et puis la mesure de nos hauteurs et poids,2
ive m'a traitée de bi romantique bisexuel pendant un moment et maintenant je m'appelle bi romantique hétérosexuel mais j'ai l'impression que le côté bi romantique est à explorer un peu plus,2
Je pouvais sentir leurs tendres coups d'amour alors que j'étais couché là les jambes enveloppées autour de ma tête de toilette sous la baignoire,2
J'ai l'impression d'avoir essayé d'être attentionnée et défaillante.,2
"Je me sens comme en ce moment avec toutes les choses à faire, à s'inquiéter et à s'organiser et parce qu'il est si solidaire, je me suis laissé oublier de lui accorder l'attention qu'il mérite.",2
im en fait se sentir plus en soutien aujourd'hui que je l'étais avant parce que je me sens vraiment désolé pour Susan,2
Je pense que vous devriez si vous faites de l'argent décent hors du site ou vous vous sentez comme soutenir beaucoup de tels sites qui rendent l'analyse de tfserver facile,2
Je sens qu'il y a un équilibre délicat entre les placer trop facilement et les rendre si élevés que vous ne pouvez pas les atteindre,2
Je lui ai fait mal quand j'ai critiqué son manque de capacité à se concentrer ce qui est en fait une chose qu'elle n'aime vraiment pas en elle-même.,2
Je pouvais sentir son souffle délicat sur mon visage,2
J'aurais toujours l'impression qu'elle disait ces choses parce qu'elle m'aimait.,2
Je n'ai pas voulu le presser parce que je veux qu'il me sente aussi solidaire mais j'ai été une épave à l'intérieur trop attendre,2
Je ressens le désir des fans fidèles de la grande musique,2
Je suppose qu'il n'a pas été surprenant que je n'ai pas vraiment ressenti quelque chose dans la classe au-delà d'une douce classe de yoga extensible pour les débutants légèrement intolérable à cause de la chaleur étouffante et le sentiment malheureux que je n'ai pas obtenu n'importe où,2
Je suis stressé une affirmation de gars quand je ne me sens pas assez jolie ou quand je veux un mari mais n'ai pas encore une course à la musique en colère quand je me sens complètement débordé de crème glacée quand je suis grincheux,2
J'apprécie vraiment et je suis reconnaissante de commencer tous mes jours à me sentir aimée,2
J'adore aller à la courbe parce que je sens que l'endroit là-bas est plutôt romantique dans la nuit,2
J'ai aussi l'impression de laisser tomber mes fidèles abonnés avec mes vains efforts ces derniers temps.,2
ive réveillé ce matin se sentant nostalgique pour les jours ensoleillés nous avons eu quelques semaines alors mon hippie intérieur veut sortir pour jouer,2
ive a récemment eu beaucoup de mauvaises nouvelles de la famille et des amis qui sont malades ou ont des difficultés et se sentent si heureux d'être en bonne santé et d'avoir une vie si merveilleuse,2
J'ai l'impression d'avoir donné un coup de pied à un chiot bien-aimé.,2
Je me sens à l'intérieur d'où je me pardonne que j'ai accepté et permis à mon environnement extérieur et les gens en lui d'affecter comment je me sens à l'intérieur et à travers un href http eqafe,2
Je sens immédiatement les vibrations quand vous touchez votre clito tendre,2
je ne sais pas comment dire à quel point vieux sans défense et inutile qu'on me fait sentir bien que je connais son commentaire attentionné conçu pour me prendre vers le haut,2
J'ai besoin de me sentir petit et délicat par rapport au garçon im avec,2
"Je veux me sentir romantique, inspirée et digne",2
"J'ai perdu le contrôle du temps sur les choses qui doivent être faites sur ce que chacun devrait faire ou ressentir correctement, mais à quel point ce sentiment d'être hors de contrôle était doux",2
"Je veux que tu ailles voir, mais je ne suis pas qu'un bout de cul que n'importe quel homme alpha peut utiliser quand il se sente excité",2
Je pense que le fond de notre histoire est que Pierce ressent le besoin d'être accepté,2
Je voulais vraiment sentir que je faisais ce que Jésus a dit et que je m'occupais des pauvres parce que j'étais ami avec une mère célibataire dont l'argent était serré et donc je lui donne la main vers le bas vêtements de bébé de temps en temps,2
Je pensais que les garçons pourraient écrire une entrée de journal assis sous un arbre ou sur le porche pour leur donner une certaine impression de la façon dont les hommes ont écrit des lettres à leurs proches,2
"Je me sens et peu importe combien je suis accepté et désiré en tant que partie du groupe qui est importante pour moi, il y a encore un potentiel d'inquiétude à se produire aujourd'hui ou peut-être un peu de blues",2
Je veux que vous vous sentiez aimé apprécié et surtout cet état euphorique de bonheur,2
J'avais besoin de chercher quelque chose pour nous aider parce que ça n'apporte pas un bon sentiment pour elle de soutenir la famille,2
Je commence à me sentir comme la petite martha ragoût accueillant ma rd douche cette année à notre douce petite maison,2
Je me suis senti un peu nostalgique sur ce que j'ai pensé id partager un peu de ce sur quoi ive travaillait,2
Je me sens relativement passionnée et c'est des lunettes de soleil,2
Je me sens très positivement à propos de cette nuit et je me souviens que c'est un moment agréable avec la famille d'amis et surtout Dieu,2
Je dirais que j'ai l'impression d'être retenu pour avoir pris soin de moi.,2
J'adore regarder des films avec un vieux décor comme celui daté me donne le sentiment satisfaisant d'être nostalgique,2
"Je me suis dit que tu savais à quel point c'était mauvais d'avoir quelqu'un qui ne soit pas loyal et honnête, mais merci d'avoir finalement révélé que mes soupçons étaient corrects, révélant ainsi ton vrai moi.",2
Je me sens les doigts doux sur la tête et je comprends que tu m'exhortes,2
J' alterne entre le sentiment de sympathie envers l'humanité et d'être un misantrope,2
"Je sais qu'au moins je suis très important et compréhensif, certaines parties de moi veulent se sentir compréhensives envers ceux de vancouver victoria et du bas continent aujourd'hui comme ils ont obtenu ce que nous prince George peeps aiment appeler un goût d'hiver",2
Je me sens toujours aimé quand mon mari les initie ce simple acte d'affection,2
Je sens mes soins tendres de sauveur,2
J'ai eu un enfant trop jeune mon corps est détruit et pour yrs on et off j'ai été soit boulimique anorexique et pour toujours sur ce régime montagnes russes pour être quelque chose que je me sens comme je ne serai jamais et maintenant pour vous chaud monstre chaud sexy mignon joli ou beau,2
Je sens que c'est un endroit romantique d'être avec votre autre moitié puisque les personnages d'insouciance ont toujours heureux après avoir fini avec leur prince charmants,2
Je lui ai dit que je ne me sentais pas très aimée.,2
Je ne vais pas te dire de ressentir des sentiments d'amour envers elle.,2
ima se sentir sympathique envers sony en raison d'un href http www,2
"Je ressens le besoin de le mentionner non seulement en tant que membre de leur équipe de rue, mais en tant que fan dévoué du groupe et de la bonne musique en général",2
Je pouvais sentir leur désir l'un pour l'autre,2
im sentiment romantique ma bande son commence par peter gabriel chantant le livre de l'amour,2
Je pense qu'une autre raison pour laquelle je n'en ai plus rien à foutre et je peux dire ce que je ressens c'est que j'ai finalement accepté que je vole seul le reste de ma vie.,2
Je me sens tellement aimé et réconforté de savoir que mes préoccupations étaient et sont assez importantes pour recevoir l'attention de mon père céleste,2
Je me sens tout romantique et tout ce que j'emmène Emily au club pour manger sam s club qui est,2
Je me sens très heureux d'être assis dans ma maison sèche sans rien se plaindre de la pluie constante,2
Je l'ai vu chaque pay per view le wwe a un concept vraiment cool avec la table de panneau à l'intérieur de l'arène lui donnant un sport comme grand temps sentir je souhaite juste qu'il y ait plus de temps consacré à elle et moins de gens dopey sur le panneau,2
Je me sens très nostalgique ce soir.,2
Je pense juste que imaginer Casey et Derek dans une sorte de relation romantique serait assez étrange malgré la façon dont ils agissent,2
Je pense que c'est une possibilité que j'aie contribué à la rupture malgré le rôle de soutien que j'ai joué pendant leur temps ensemble.,2
"Je devrais probablement donner ce titre au sentiment de désir, mais qui dit ce qui est plus juste",2
je me sens déjà nostalgique,2
Je m'en fiche tant que je peux lui faire confiance et savoir qu'elle sera fidèle quand elle sera avec moi.,2
Je dois dire que c'est tout simplement agréable d'être entouré de personnes positives et d'accepter,2
Je veux sentir ton toucher doux et je sens la chaleur quand je suis à tes côtés,2
Je me sens vraiment compatissant pour les animaux et les plantes qui sont morts pour faire cette nourriture,2
Je me souviens avoir tant envie d'être comme un scout qui n'a jamais tenu à ce que quelqu'un pensait d'elle,2
Je sens la pression et je l'aime.,2
J'ai l'impression d'avoir consacré ma vie aux poupées de dresden et à la sale brigade d'affaires.,2
d'habitude si fort mais elle a cette capacité de me faire sentir comme un enfant coquin qui ne sait pas de quoi elle parle,2
Je me suis rendu compte que pendant une journée normale au travail je bois des tasses de café mais à peine sentir n'importe quelle différence et ici dans l'Himalaya une tasse de thé chaud ferait des merveilles à une âme épuisée,2
Je lui ai dit que je n'avais pas l'impression qu'il soutenait.,2
"Je serai le premier à dire que je ne mettrais rien au-delà de la grande agribusiness pour tirer des shenanigans, mais je pense qu'il y a des organisations consacrées à être notre chien de garde",2
Je suis dans cet endroit où tout est si tendre,2
Je pense que mon sentiment est que j'ai aimé le script et le design mais pas la direction,2
Je ne me sens toujours pas bien mais j'ai toujours réussi à terminer mon travail à Elixia aujourd'hui,1
Je me sens très productif mais en même temps je me sens comme un nettoyage de dix mois d'accumulation,1
J'ai aussi acheté ma juste part de livres ces derniers temps aussi livres que je me sens peut venir en utile et m'inspirer,1
Je me sens comme je dois mentionner le mignon millésime beau jour sy empiler tasses de thé non inclus dans le qui sont nzd de www,1
Je pense qu'il est très important pour les enfants de savoir nager,1
Je suis impatiente d'y aller.,1
Je vais sentir que glamour tout en portant ma propre nouvelle lingerie de gâteau,1
Je ne peux pas penser à un autre endroit église au moins sur le campus que quelqu'un avec des doutes sur la foi ou un manque total de foi pourrait entrer et se sentir tout aussi bien accueilli et respecté que quelqu'un fou amoureux de Jésus,1
J'ai l'impression d'avoir rencontré quelqu'un qui étincelle entre nous et j'ai ce genre d'anticipation avide de sentir qu'il y a bientôt un baiser à l'horizon,1
"J'ai l'impression d'être une fille intelligente, mais parfois je ne le sens pas.",1
Je me sens assuré cependant que Genl,1
J'ai fait une femme à plein temps sans le sexe opposé admirer la vision de ne suivre pas de fleurs romantiques et surprises de ces gens criant je sens qu'ils sont seulement qiuniao si impatients de ciel message,1
J'ai trouvé profond ou partager mes pensées sur ces gens livres des films ou des produits que je me sens utiles et significatifs dans ce voyage de la vie,1
Je me sens tellement boxcar racer juste une fille sans doute innocente notre nourriture de paix en mangeant sont vous plus préoccupés par le goût ou la santé,1
J'ai l'impression d'être toujours excitée que pomme va annoncer un tas de choses liées au jeu à ces et inévitablement je suis déçue,1
Je sens que ça a l'air plutôt festif.,1
Je dois sentir la fin de la pression des yars et le blues heureux,1
